PuzzleId,FEN,Moves,Rating,RatingDeviation,Popularity,NbPlays,Themes,GameUrl,OpeningTags
00Hxb,1rbr1k2/p4ppp/2B5/2pR1NP1/2P5/P7/7P/4R1K1 b - - 0 27,d8d5 e1e8,1125,81,83,1105,endgame mate mateIn1 oneMove,https://lichess.org/FW9LwaHK/black#54,
00HzH,2r2Qk1/p2q2p1/1p2p1Np/3p3P/3Pb1P1/2P5/PP3R2/6K1 b - - 4 33,c8f8 f2f8 g8h7 f8h8,766,90,91,390,endgame hookMate mate mateIn2 short,https://lichess.org/XB8lgZ9N/black#66,
00HzX,4r1k1/5pp1/2R4p/1p6/8/1PP3QP/2q2PP1/6K1 w - - 0 29,c6h6 c2c1 g1h2 c1h6,1607,74,92,1383,crushing endgame fork short,https://lichess.org/tKKATkce#57,
00I8g,4rk2/3Rnrp1/8/4Q1p1/7P/6K1/8/8 w - - 0 50,h4g5 e7f5 e5f5 f7f5,950,76,100,350,crushing endgame short,https://lichess.org/5U3wSf5r#99,
00ICz,2k2rr1/1p1q3p/1p2p3/1NbpQ3/P1p2P2/6P1/6KP/R4R2 b - - 0 31,f8f5 b5a7 c8d8 e5b8 d8e7 b8g8,1276,75,96,4710,crushing long middlegame skewer,https://lichess.org/aGEDdbh2/black#62,
00IDw,4r3/pN3kpp/2N1b3/2R5/5b2/P7/1P3PPP/7K w - - 1 30,g2g3 e6h3 c5c1 f4c1,1862,75,86,152,advantage endgame quietMove short,https://lichess.org/KmTVU8Fo#59,
00IEW,6k1/6p1/R6p/3P1N2/8/3K4/2r2b2/8 b - - 5 57,c2c8 f5e7 g8f7 e7c8,903,114,100,27,crushing endgame fork short,https://lichess.org/yowrXxcg/black#114,
00IF1,1k6/p1p5/P2p4/3P4/1PK2N1p/4P3/5r2/4B3 b - - 12 57,f2f4 e3f4 h4h3 e1g3,1267,80,93,601,crushing defensiveMove endgame hangingPiece short,https://lichess.org/bX3dAdx9/black#114,
00IHi,8/4R3/1k6/8/p7/1p1N2P1/5KP1/r7 w - - 0 55,e7e1 a1e1 f2e1 a4a3 e1d2 a3a2 d2c3 a2a1q,1849,75,95,3742,advancedPawn crushing endgame promotion veryLong,https://lichess.org/DiBepPdz#109,
00IMS,1r4k1/r5q1/p2p1pP1/4pP2/2p1P2Q/2PbnBK1/P6R/2R5 b - - 7 35,e3f5 e4f5 d3f5 f3d5,1714,74,91,227,clearance crushing kingsideAttack middlegame short,https://lichess.org/4sOYAEfF/black#70,
00IPp,4Q3/6pk/p3p2p/5p2/1p1P2P1/4q2P/2B1n2B/7K w - - 0 35,g4f5 e3f3,1572,88,89,2347,endgame mate mateIn1 oneMove,https://lichess.org/JKNcTJw1#69,
00ISm,5r2/4bp1k/2ppq1p1/4p1Q1/4N2P/3P4/1P1R1P2/4K1R1 b - - 0 29,e7g5 e4g5 h7h6 g5e6,907,88,84,86,crushing endgame fork short,https://lichess.org/Nx7iGvHH/black#58,
00ITc,3r1rk1/3b1pp1/7p/8/N2Qp1n1/1P6/PB1q1PP1/R5K1 b - - 1 25,d7a4 d4g7,922,80,88,121,mate mateIn1 middlegame oneMove,https://lichess.org/tGroDLV4/black#50,
00IUW,8/Q1p1r1kp/5pp1/3P3r/4P3/2N2bPq/PPP2R1P/5RK1 w - - 3 23,a7e3 h3g3 h2g3 h5h1,1725,74,100,224,clearance kingsideAttack mate mateIn2 middlegame sacrifice short,https://lichess.org/83tyhOfz#45,
00IaZ,4R3/1k2R3/3K2p1/1P6/1P6/2rp3r/8/8 b - - 3 45,b7b6 e8b8,923,86,83,430,endgame master mate mateIn1 oneMove rookEndgame,https://lichess.org/MA0bo8dV/black#90,
00IbM,6k1/5rp1/p2B3p/P1Pp4/1P6/2q1P2P/4Q1P1/6K1 w - - 0 34,e2a6 c3e1 g1h2 f7f1 a6f1 e1f1,1629,103,90,18,advantage endgame long quietMove,https://lichess.org/u2FmrsSU#67,
00IiM,r5k1/pp4p1/1n6/3pB3/3P2pb/2NQ1r2/PP6/2K3R1 w - - 2 24,d3f3 g4f3 g1g7 g8f8,1719,75,92,2911,advantage middlegame short,https://lichess.org/qzEITbaG#47,
00InW,8/2p5/pp1p4/3PnN2/PPP1Pp2/5P1p/5K1k/8 b - - 3 46,e5f3 f2f3 h2g1 f3f4 h3h2 f5g3,1381,74,100,783,crushing defensiveMove endgame hangingPiece knightEndgame long,https://lichess.org/CZaimWSp/black#92,
00IpT,r1bk3r/ppp1n2p/3pNQ2/8/2BpP2p/8/PPPq2PP/R5K1 b - - 2 21,d8d7 f6h8 d7c6 h8e8,2089,117,85,19,crushing hangingPiece middlegame short,https://lichess.org/pxYUaQJx/black#42,
00IqI,r5k1/pp3ppp/2p5/4pb2/2B2q2/P1P1nP2/1P1Q3P/3R1R1K b - - 1 22,e3c4 d2d8 a8d8 d1d8,1537,107,67,25,backRankMate master mate mateIn2 middlegame sacrifice short,https://lichess.org/I0tBjrDC/black#44,
00Ivf,8/2p4r/1p3k2/p2Pp1p1/P1P1RpP1/1P3P1r/4R1K1/8 w - - 7 46,e4e5 h3h2 g2f1 h2h1 f1f2 h7h2,1619,74,91,194,endgame long mate mateIn3 rookEndgame,https://lichess.org/VX0fLjAC#91,
00J1Y,1q3r2/p5k1/1p2pbpp/2p2p2/2P1N3/2P2PQP/PP3P2/6RK b - - 2 29,f5e4 g3g6 g7h8 g6h6,1182,77,93,807,deflection endgame mate mateIn2 short,https://lichess.org/8onUzszE/black#58,
00J1t,r1qr3k/pp3pB1/1np1pb2/8/3P3P/2N2PR1/PP1Q2P1/2KR4 b - - 0 22,f6g7 d2g5 d8g8 g5h5 g7h6 h5h6,1617,74,97,12959,exposedKing kingsideAttack long mate mateIn3 middlegame,https://lichess.org/77hjhVfM/black#44,
00J5r,r4rk1/1p4p1/p1p1n1Pp/q3p3/4P3/2N1QP2/PPP5/2KR3R w - - 0 21,h1h6 g7h6 e3h6 a5c7,2112,76,85,101,crushing defensiveMove master middlegame short,https://lichess.org/1DzEGAx8#41,
00J7i,3r2k1/pQ3ppp/4R1n1/2q5/2P5/2B3P1/P4PBP/6K1 b - - 0 24,f7e6 b7g7,999,102,69,55,endgame master masterVsMaster mate mateIn1 oneMove,https://lichess.org/nBfwpOrE/black#48,
00JET,3r2k1/5ppp/3Rp3/8/8/8/1P3PPP/2R3K1 b - - 0 34,d8d6 c1c8 d6d8 c8d8,409,99,94,209,backRankMate endgame mate mateIn2 rookEndgame short,https://lichess.org/O8W3yIa7/black#68,
00JFF,4r1k1/ppqb3p/6B1/3pb2Q/8/2P5/PP1B2PP/5RK1 b - - 0 20,h7g6 h5g6 e5g7 f1f7 c7c5 g1h1 c5f8 f7f8,2015,98,88,46,crushing middlegame pin veryLong,https://lichess.org/e986oDw6/black#40,
00JH5,8/2Q2pk1/8/3pp2P/8/2Pq4/KP6/8 b - - 1 36,d3c4 c7c4 d5c4 b2b4,2031,87,86,41,crushing defensiveMove endgame queenEndgame short,https://lichess.org/1co2FGQN/black#72,
00JMV,8/1p4pk/pPp4b/P1P1P3/3pq1b1/2Q5/6PP/2B2RK1 w - - 0 32,c3e1 e4e1 f1e1 h6c1,2188,79,91,194,advantage endgame short,https://lichess.org/DRP46kUW#63,
00JO7,5rk1/ppq3pR/4p1r1/3p4/8/2P4Q/PP3RPP/6K1 b - - 0 22,c7c5 h7h8,986,79,89,79,endgame mate mateIn1 oneMove,https://lichess.org/Vd3DWn3Y/black#44,
00JQS,5r1k/pb3Qpp/2p5/5p2/3P4/8/PPP2PPP/4R1K1 b - - 0 21,f8f7 e1e8 f7f8 e8f8,561,98,76,635,backRankMate endgame mate mateIn2 short,https://lichess.org/jB9KjawU/black#42,
00JR7,r4rk1/pp2q1p1/2p1p2p/3nP1pP/3P2P1/2PQ1R2/PPB5/R5K1 b - - 1 23,f8f3 d3h7 g8f7 c2g6 f7f8 h7h8,1500,75,98,1289,kingsideAttack long mate mateIn3 middlegame,https://lichess.org/jSoa2xnc/black#46,
00JS1,2r5/1p2k1pp/4p3/1N3p2/5P2/P2nP3/1R4PP/6K1 w - - 0 24,b2d2 c8c1 d2d1 c1d1,566,102,77,684,endgame mate mateIn2 short,https://lichess.org/ROJJOhHY#47,
00JZk,7k/1q5p/3Q2p1/8/P3p3/1p2B2P/1br3P1/R5K1 b - - 0 32,b7f7 a1f1 f7f1 g1f1,2105,75,91,2258,crushing endgame short,https://lichess.org/YuyVHFxe/black#64,
00JaW,8/r7/Pk5p/3R2p1/4p1P1/4P3/3K4/8 b - - 0 48,a7a6 d5d6 b6a5 d6a6 a5a6 d2c3 a6b7 c3d4,1080,80,88,201,crushing endgame exposedKing rookEndgame veryLong,https://lichess.org/K2MPI0zt/black#96,
00JfN,r6r/1bpnk3/1p1pB3/pP1P3q/P3PQP1/2b2N1P/2P2P2/R3R1K1 b - - 0 24,h5h3 f4f7 e7d8 f7d7,991,77,100,260,mate mateIn2 middlegame short,https://lichess.org/Srytn3TD/black#48,
00JqT,2r2rk1/pp2R3/5p2/3p1q2/3P4/4QPPp/PP3R1P/6K1 w - - 2 30,g3g4 f5b1 f2f1 b1b2 e3e6 g8h8,1952,74,100,281,crushing deflection endgame long,https://lichess.org/HwVtqWsg#59,
00JtR,1rbk3r/3qp1b1/p3p1Bp/1N1P2p1/8/P5P1/1P2Q1P1/R3K2R w KQ - 2 23,d5e6 d7b5 e2d2 d8c7 a1c1 c7b7 g6e4 b7a7,2241,76,93,3064,crushing defensiveMove middlegame veryLong,https://lichess.org/eQy3tkuB#45,
00JzT,8/7p/6pK/5p2/4p3/1k4P1/5P1P/8 w - - 2 44,h6h7 g6g5 g3g4 f5f4,1660,77,79,79,crushing defensiveMove endgame pawnEndgame quietMove short,https://lichess.org/Zk86Dja7#87,
00K0G,8/8/8/2Pk4/pK4p1/3N4/5P2/3b4 b - - 7 59,d1e2 d3f4 d5c6 f4e2,777,87,80,88,crushing endgame fork master short,https://lichess.org/xIDctz9w/black#118,
00K48,6Qk/6pp/p2B4/2pP4/P1q5/6P1/2P1p2P/5RK1 b - - 0 26,h8g8 f1f8,453,108,89,285,endgame master mate mateIn1 oneMove,https://lichess.org/vGu9FCAH/black#52,
00KHR,8/6pk/1Q1p2n1/4p3/2P3P1/P2PP2P/1B4K1/4q3 w - - 1 35,g2f3 g6h4 f3e4 e1h1,1412,75,93,1492,endgame mate mateIn2 short,https://lichess.org/m54DAZPv#69,
00KMV,1r3k2/1p1q1p2/p2p1np1/2pP2bp/2P1P1n1/1PQ3P1/P3N1K1/3N1R1R b - - 11 28,f6e4 c3h8 f8e7 h8b8,953,85,93,2630,crushing middlegame short skewer,https://lichess.org/zMA7YEmv/black#56,
00KNB,2rr2k1/5p2/4p2p/4N1pQ/1p3P2/4P3/np3P1P/2q2BRK b - - 1 32,c8c7 h5h6 b2b1q h6g5,2491,99,88,507,crushing kingsideAttack master middlegame pin short,https://lichess.org/Ri0duT8T/black#64,
00KNK,r3r1k1/p1p4p/3b4/4p1qN/8/1P1b1Q2/P2P1PP1/B5KR b - - 2 22,e5e4 h5f6 g8f8 f6h7 f8e7 a1f6 g5f6 f3f6,2035,76,91,678,advantage deflection doubleCheck fork middlegame veryLong,https://lichess.org/L8oTZ2cM/black#44,
00KO5,2r2rk1/3p1ppp/p3p3/1p2q3/6P1/3Q4/PP5P/1K2RR2 b - - 0 22,e5h2 f1h1 h2c2 d3c2 c8c2 b1c2,1351,76,87,134,advantage endgame long,https://lichess.org/jUnUTglG/black#44,
00KOz,8/r4k2/7R/5PK1/1n6/8/8/8 b - - 3 56,b4d5 h6h7 f7f8 h7a7,969,98,95,1083,crushing endgame master short skewer,https://lichess.org/QVprMNzR/black#112,
00KSB,r7/4kpRp/2p2p1P/p1P1n3/Pp6/1B6/5PP1/6K1 b - - 2 35,a8h8 f2f4 e5d7 g7f7,1523,74,94,7051,crushing endgame short,https://lichess.org/GqvPZnmI/black#70,
00KVO,4r3/p1R3p1/4r2p/3k1n2/3p4/P5B1/1P4PP/4R1K1 w - - 2 28,c7a7 e6e1 g3e1 e8e1,834,95,76,54,crushing endgame short,https://lichess.org/4wKfUa8h#55,
00KVb,2k2r2/pp5p/3p4/3Nb1p1/8/1P1P3P/P1Pn4/1K1R1R2 w - - 3 28,d1d2 f8f1 d2d1 f1d1,556,98,72,171,endgame hangingPiece mate mateIn2 short,https://lichess.org/tzIW1ZLM#55,
00KYC,5rk1/p6p/2r1pBp1/4P3/2b5/3p4/P4PPP/1R2R1K1 w - - 0 27,b1b7 f8f6 e5f6 d3d2 e1d1 c4e2,2268,83,83,53,advancedPawn clearance crushing endgame long master sacrifice,https://lichess.org/wxhreSsZ#53,
00KYU,3r4/p2n2kp/1p2Bpp1/2r2N2/4q3/6QP/P5P1/5R1K b - - 1 40,g7f8 g3d6 f8e8 d6e7,1204,74,100,890,mate mateIn2 middlegame short,https://lichess.org/UlNVmHbT/black#80,
00Kbj,8/8/6p1/PR3p2/1P3k2/7P/r5P1/7K w - - 1 39,h3h4 f4g3 b5d5 a2a1 d5d1 a1d1,1488,73,94,15903,endgame long mate mateIn3 rookEndgame,https://lichess.org/PW8a1JvE#77,
00Kd8,3R4/3P4/8/5p2/5kPp/8/3r1KP1/8 w - - 1 64,f2g1 f4g3 g1f1 f5g4,2133,75,80,270,advantage endgame rookEndgame short,https://lichess.org/loJK0sJF#127,
00Keu,R7/1p3kp1/2pK3p/3p1PP1/1r1B2nP/8/1P6/8 b - - 2 39,b4d4 g5g6 f7f6 a8f8,854,92,94,1388,endgame mate mateIn2 short,https://lichess.org/hCWa2OUn/black#78,
00KgR,5r1k/1pq3p1/2p2P1p/3pPQ2/1p1P4/7P/1rB4K/5R2 b - - 1 35,f8f6 f5h7,794,77,100,458,endgame mate mateIn1 oneMove,https://lichess.org/8f0kmTFT/black#70,
00KhM,5rk1/5ppp/1R6/3Qp3/2B1P3/2q3P1/3R1PKP/1r6 b - - 0 27,b1b6 d5f7 f8f7 d2d8,1339,93,78,42,clearance endgame mate mateIn2 pin sacrifice short,https://lichess.org/o5Jg9MLX/black#54,
00Kia,5r1k/4n1pp/1p6/pP5Q/P2pB2K/6P1/2P4P/4q3 b - - 4 37,g7g6 h5e5 h8g8 e4d5 e7d5 e5e1,1666,76,97,2023,advantage discoveredAttack endgame fork long,https://lichess.org/hH8qwFYM/black#74,
00Kip,8/6pp/8/3k4/2p2PPP/2K5/8/8 w - - 1 50,f4f5 d5e5 h4h5 h7h6 g4g5 h6g5,2521,83,89,92,crushing endgame long pawnEndgame quietMove,https://lichess.org/hcNxh7C3#99,
00Kq4,r2qk3/5p1r/p1p1p3/1p1pP1p1/P1nP2Pn/2P2NB1/2P2P2/R1QR2K1 w q - 1 21,f3g5 d8g5 c1g5 h4f3 g1g2 f3g5,1435,75,83,553,advantage attraction fork long middlegame sacrifice,https://lichess.org/o4K7aQsT#41,
00Ksa,8/5p2/5pk1/8/4PP2/6r1/5K2/7R b - - 2 46,g3g4 f2f3 g4g5 f4g5,1828,76,85,85,crushing endgame rookEndgame short trappedPiece,https://lichess.org/WynrZVil/black#92,
00Kyy,8/P7/8/5k2/8/5pr1/5r2/R6K w - - 0 50,a7a8q g3h3 h1g1 f2g2 g1f1 h3h1,1204,75,83,253,endgame exposedKing long master mate mateIn3 queenRookEndgame,https://lichess.org/VrBw9rnh#99,
00L4x,1r4k1/4Ppbp/p5p1/2q5/p2n4/P2Q2B1/r2N1PPP/3KR2R b - - 0 27,g7h6 e7e8q b8e8 e1e8,1243,79,91,2723,advancedPawn crushing kingsideAttack middlegame promotion short,https://lichess.org/kQUg1Hn3/black#54,
00L53,3q2k1/Qp4pp/3r4/P7/8/1P6/3p1PPP/3R2K1 w - - 0 35,a7b7 d6e6 b7b4 d8d4 b4b8 g8f7 b8b7 f7g6 g2g3 e6e1,2535,89,79,30,clearance crushing defensiveMove endgame quietMove veryLong,https://lichess.org/nSpAg1ZO#69,
00L84,6k1/5pp1/7p/2p5/2P5/2rp2PP/PR3P2/5K2 w - - 0 37,b2b3 c3c1 f1g2 d3d2,1067,87,93,655,advancedPawn crushing endgame master rookEndgame short,https://lichess.org/ZX4yckwu#73,
00LBF,3r2k1/1b2qpb1/pp4p1/3rp3/3R2P1/2P2NBP/PP2Q2K/3R4 b - - 0 33,e7d7 d4d5 b7d5 c3c4,2179,80,82,68,advantage master middlegame short,https://lichess.org/HG0KKbWc/black#66,
00LG5,6k1/5r1p/4b1pQ/5q2/3B3P/2P5/6P1/4R1K1 w - - 7 36,e1e2 f5f1 g1h2 f1e2,1113,77,71,157,advantage endgame fork short,https://lichess.org/H1PJMeLA#71,
00LH7,6k1/6Bp/6pP/3q1p2/p2PnQ2/2r5/P5PK/4R3 b - - 1 39,d5d6 e1e4 d6f4 e4f4,1467,76,94,5622,crushing endgame short,https://lichess.org/7mA63Gfs/black#78,
00LMb,8/8/1n4kP/1P3p2/3P1K2/2p1N3/8/8 w - - 4 49,f4e5 b6c4 e3c4 c3c2,1771,81,79,54,advancedPawn crushing endgame knightEndgame sacrifice short,https://lichess.org/8fplizkC#97,
00LNB,kr6/1pR4p/p4R2/n2r4/P3p3/4B3/6PP/6K1 b - - 0 38,d5d3 f6a6 b7a6 c7a7,969,84,98,2641,endgame mate mateIn2 sacrifice short,https://lichess.org/MQYDGoEM/black#76,
00LO6,2r3k1/3q1pp1/1rp5/2Rn2Np/1p1N3n/1Q2P3/5PP1/2R3K1 w - - 0 33,c5d5 c6d5 c1c8 d7c8,1655,75,89,78,advantage middlegame short,https://lichess.org/X0I5NJuv#65,
00LOy,5k2/1p3pp1/p3pb2/r7/2P2B2/1P6/1PR1K1PP/8 b - - 0 33,f6e5 b3b4 a5a1 f4e5,1483,76,94,12494,crushing endgame short,https://lichess.org/dq3UiVvj/black#66,
00LRq,1k6/1p1q4/P2p3p/1NpPpn1Q/5b2/2P3r1/1P2B1P1/R6K b - - 3 28,g3g7 a6a7 b8a8 b5c7 d7c7 h5e8 c7b8 a7b8q,2059,83,92,1693,advancedPawn doubleCheck mate mateIn4 middlegame promotion queensideAttack sacrifice veryLong,https://lichess.org/i9yxFCW9/black#56,
00LRv,5r1k/7p/p2pB3/3Pb1p1/4p2q/1P2B3/P1Q2P2/2R3K1 w - - 0 31,f2f4 h4g3 g1h1 g3f3 c2g2 f3e3,2411,93,70,70,crushing exposedKing fork long middlegame,https://lichess.org/AebpnUup#61,
00LSv,3r3k/1p4pp/2p3q1/8/3Q4/8/PP4rP/R4R1K b - - 1 28,g2g1 d4g1 g6e4 g1g2,1742,75,92,902,advantage endgame short,https://lichess.org/EfV2OOTd/black#56,
00LWX,2r4k/5p2/4pNp1/6Pp/q6P/7r/2PQ4/1RKN4 w - - 2 37,d2b4 c8c2,741,78,100,264,mate mateIn1 middlegame oneMove,https://lichess.org/xNp6E0CA#73,
00LXD,8/p7/1p2k1pp/5p2/3P1P2/4K3/PP5P/8 w - - 2 37,a2a4 g6g5 f4g5 h6g5,2318,83,26,52,advantage endgame master pawnEndgame short,https://lichess.org/aSmBXG8T#73,
00LdT,r5k1/pbp2ppp/6q1/2pp4/3B3r/2P1R1P1/PP2QP1P/R5K1 b - - 1 20,c5d4 e3e8 a8e8 e2e8,587,93,80,159,kingsideAttack mate mateIn2 middlegame short,https://lichess.org/MH7zaBHa/black#40,
00Lh9,4r3/7P/1p4Q1/1b4B1/1k4n1/8/1P2n1PK/4R3 w - - 2 41,h2h1 e2g3 h1g1 e8e1,1324,188,85,15,discoveredAttack mate mateIn2 middlegame short,https://lichess.org/pOgHjjVE#81,
00Lhb,2n4k/p3b2p/Pp6/1PpPp3/2B1PpP1/1P6/5BK1/8 b - - 0 33,c8d6 f2c5 b6c5 b5b6 a7b6 a6a7,1790,85,89,44,advancedPawn advantage endgame long master masterVsMaster sacrifice,https://lichess.org/PN1IyrE7/black#66,
00LoE,2k5/1p4p1/p4b2/3p4/3P4/2PQN3/PP3q2/1K6 w - - 0 37,e3d5 f2g1 b1c2 g1g2,1858,75,46,121,crushing endgame short,https://lichess.org/bDt5hp3w#73,
00Lqo,2Q5/p5pk/1r2p3/K2pP2p/3P4/2P4R/PPq5/8 b - - 12 41,c2b2 h3h5 h7g6 c8e8,1175,151,33,16,endgame mate mateIn2 short,https://lichess.org/7t0X6qSm/black#82,
00Lt1,r4k2/pp3p2/2pNR2p/5Qp1/1P3n2/3P4/P1PK1qPP/8 w - - 6 31,d2c3 f4d5 c3b3 f2f5 d6f5 f7e6,1741,76,94,320,advantage discoveredAttack endgame long,https://lichess.org/CcaXmpEd#61,
00Lyc,4R3/1p4k1/1q1N1bpp/3B4/5p1P/p4P2/3RK1P1/8 w - - 4 42,d6e4 b6b5 d2d3 b5e8,1935,76,78,133,crushing endgame fork master short,https://lichess.org/YB9ozD4y#83,
00M0i,r3r2k/p2n1p1R/5n2/qp3Q2/3P4/B3Pp2/P4P1P/1B5K b - - 0 23,h8g8 f5g5,1126,76,67,139,mate mateIn1 middlegame oneMove,https://lichess.org/ZWoXGjH0/black#46,
00M1q,2r3k1/2r1q1p1/p3p1Q1/1p1p4/nP1P4/2P4R/P4PPP/2R3K1 b - - 0 30,e7f6 g6h7 g8f7 h3f3 f6f3 g2f3,1385,74,91,3147,advantage long middlegame pin,https://lichess.org/nsAQV9mj/black#60,
00M6i,6k1/1N4pp/p7/4bp2/P1P5/1r6/6PP/2R3K1 w - - 1 33,b7c5 e5d4 g1f1 d4c5,1143,119,43,19,crushing endgame fork short,https://lichess.org/kUhFtcHh#65,
00MBF,7k/np2b1pp/p1b2p2/2P1pq2/PPQ4P/5PP1/1B5K/3BN3 b - - 0 29,c6d7 d1b3 f5h3 h2g1 d7e6 c4e6 h3e6 b3e6,2002,77,84,88,advantage middlegame quietMove veryLong,https://lichess.org/qknEpIjx/black#58,
00MDy,8/pp6/2p1k3/2Pp2pp/1P1P1p2/P2K1P2/6PP/8 w - - 0 42,g2g3 f4g3 h2g3 h5h4 g3h4 g5h4,1496,75,93,148,crushing endgame long pawnEndgame,https://lichess.org/LQDmrg5w#83,
00ME0,8/1p6/p1b5/5k1p/1PB1p2P/P3P1K1/8/8 b - - 2 35,f5e5 c4f7 c6d7 f7h5,1625,78,91,3234,bishopEndgame crushing endgame short,https://lichess.org/Z2H5mRQg/black#70,
00MFe,3r3k/p5pp/2r2q2/2p4Q/8/8/P5PP/3R1R1K b - - 5 29,d8d1 h5e8 f6f8 e8f8,1384,75,93,2128,endgame mate mateIn2 short,https://lichess.org/d1J7UJ4D/black#58,
00MGA,r3r1k1/6b1/p2Nn2p/1P1Qp3/6nq/2P5/1PB2PP1/R1B1R1K1 w - - 1 30,g2g3 h4h2 g1f1 h2f2,919,92,91,883,kingsideAttack mate mateIn2 middlegame short,https://lichess.org/dsGjft94#59,
00MHi,8/8/5pp1/5k1p/5P1P/4R1P1/2r5/5K2 w - - 0 43,e3e2 c2e2 f1e2 f5g4 e2f2 g4h3,2231,81,73,217,crushing endgame long rookEndgame zugzwang,https://lichess.org/im48PGD7#85,
00MIY,6k1/3R3p/1p5q/3P4/3QP1pN/6P1/PPr3B1/5rK1 w - - 0 25,g1f1 h6c1 d4d1 c1d1,1500,82,83,50,endgame mate mateIn2 short,https://lichess.org/SHHHsXB9#49,
00MNf,r1b3k1/pp3Rpp/3p4/2pN4/2P4b/5Q1P/PPP3P1/4qNK1 b - - 0 21,h4f6 f7f6 g7f6 f3f6,2027,145,50,19,crushing middlegame short,https://lichess.org/S4llTtjA/black#42,
00MTG,4r1k1/2p1qpp1/3p4/1p1P2PQ/1P5b/3R3P/2PBr3/5RK1 b - - 6 26,h4f2 f1f2 e2f2 g1f2,767,106,93,275,advantage middlegame short,https://lichess.org/iabpAKVz/black#52,
00MWz,8/8/2B5/4pK2/3k1pPp/5n1P/8/8 b - - 3 57,f3g1 g4g5 g1e2 g5g6,844,86,98,2368,crushing endgame quietMove short,https://lichess.org/1sHbVvW6/black#114,
00MYL,1R6/3k1Q2/p2b1p2/2r1p3/3n4/P6P/5PP1/4qBK1 b - - 1 40,d7c6 f7b7,1140,81,94,577,mate mateIn1 middlegame oneMove,https://lichess.org/fwb6IEPk/black#80,
00MZr,1k5r/ppp5/2p5/3n4/5pQ1/3P1P1r/PPP2K2/5R2 w - - 2 26,f1g1 h3h2 g1g2 d5e3,1991,78,90,1432,crushing endgame short,https://lichess.org/LITlSDhw#51,
00Mbv,2k2b1r/pp3ppp/1n6/BN2p1P1/2Q1Nn1P/8/PP3P2/2KR4 b - - 0 24,b6c4 d1d8,1536,81,93,3689,mate mateIn1 middlegame oneMove,https://lichess.org/h1QfViUk/black#48,
00Mca,1k6/1Pp1rqp1/p1R5/6pp/Q6P/1P6/P4PBK/3r4 b - - 5 34,e7e6 a4c4 e6c6 c4f7,2323,79,90,4537,crushing endgame short,https://lichess.org/FcSCJACK/black#68,
00Mei,8/6rk/6p1/1R3b1p/2pQ1P2/2P3P1/qP4PK/8 b - - 0 36,f5d3 d4d8 a2a7 b5b8 a7b8 d8b8,2591,86,83,213,advantage endgame long master quietMove,https://lichess.org/xvCSyLc3/black#72,
00Mf0,2kr3r/pp1b1pq1/2n1p3/2Pp4/5Np1/1QP3P1/P4PBP/R4RK1 b - - 4 19,g7h6 f1b1 h6h2 g1f1 c6a5 b3b4,2370,93,89,511,advantage long master middlegame quietMove,https://lichess.org/rkMC42R8/black#38,
00Msq,r5k1/1pp2Bp1/5n1p/1q2N3/3P4/7P/5PP1/4Q1K1 b - - 2 30,g8f8 f7c4 b5c4 e5c4,1877,80,93,808,crushing endgame master short,https://lichess.org/2cdEjZvR/black#60,
00MwU,3r1b1R/ppq3p1/2k3P1/3p4/1P1Q4/4PP2/P1P5/2K5 b - - 0 26,a7a6 h8f8 d8f8 d4c5 c6d7 c5f8,1768,75,91,269,advantage attraction endgame fork long sacrifice,https://lichess.org/r7d4mCDm/black#52,
00MyT,r3q3/1ppknr2/p5pB/2pPn3/4P3/8/PPQ3BP/2K2R1R w - - 0 22,c2c5 e5d3 c1c2 d3c5,923,90,73,48,crushing fork middlegame short,https://lichess.org/IhPV4vCX#43,
00Mzs,r6r/p5pp/1p3nk1/5n2/1q6/5N2/P5PP/R2QR2K b - - 1 24,a8d8 f3e5 g6g5 e5f7,2017,136,25,12,advantage middlegame short,https://lichess.org/RWXjVv9Z/black#48,
00N3B,r2q1rk1/1bb2ppp/p1n1p3/4P3/Np1P4/1B2NP2/1P4PP/2RQ1RK1 b - - 0 20,d8d4 d1d4 c6d4 c1c7 d4b3 c7b7,1196,75,97,3298,crushing long middlegame,https://lichess.org/knYvxXRq/black#40,
00NAM,r5k1/pp3ppp/8/3p4/3P4/4R2P/q1P1QPPK/8 b - - 1 21,a2c4 e3e8 a8e8 e2e8,762,76,100,376,endgame mate mateIn2 short,https://lichess.org/be70QtoL/black#42,
00NBR,8/1p2np2/1Pp1k3/p1P3p1/P2K3p/7P/4BPP1/8 b - - 1 33,e7d5 e2c4 e6d7 c4d5,2022,85,84,42,crushing endgame master short,https://lichess.org/CYEsHleN/black#66,
00NEO,4qr2/pR1b2pk/5p1p/4pPP1/3bB3/3P3Q/P1r4P/4BR1K b - - 0 24,d7c6 h3h6 h7g8 h6g7,1961,78,93,1401,mate mateIn2 middlegame pin short,https://lichess.org/43Kqr7qG/black#48,
00NGM,3k1rr1/pR1b3Q/2pqp3/8/N2P4/8/5PB1/R4K2 w - - 5 34,b7a7 f8f2 f1e1 d6b4 a4c3 b4c3 e1f2 c3d4 f2f1 g8f8,2351,196,75,10,crushing middlegame veryLong,https://lichess.org/Z5cYm9YQ#67,
00NKk,2r2rk1/pp4q1/4Q3/3p4/3P4/P1P5/1P3PPP/4R1K1 b - - 0 25,g8h8 e1e3 c8c7 e3h3,1848,75,91,241,advantage endgame quietMove short,https://lichess.org/eKEoNNem/black#50,
00NOI,3r4/2k2p1p/pp2pp2/2p5/3nN3/6P1/PPP2PRP/2K5 w - - 2 23,e4f6 d4e2 c1b1 d8d1,964,92,60,38,backRankMate endgame mate mateIn2 short,https://lichess.org/Z7mmtXNG#45,
00NUS,4rk2/pbp2pp1/1p1b4/3P1q2/QPBPN3/1KP2P2/P5r1/R3R3 w - - 0 25,e4d6 f5c2 b3a3 c2b2,1348,75,98,5449,mate mateIn2 middlegame short,https://lichess.org/jQaVQrR6#49,
00NUc,6k1/6pp/1PP5/4b3/3p4/Br5P/4prP1/R5RK w - - 1 30,c6c7 b3h3 g2h3 f2h2,1536,107,81,55,endgame mate mateIn2 sacrifice short,https://lichess.org/8FRZVN6d#59,
00NVe,2B4k/p1p3pb/8/5pnr/8/2P2R2/PPP2K2/6R1 w - - 6 34,c8f5 g5f3 f5g4 f3g1,1821,86,80,34,advantage endgame short,https://lichess.org/7yU1Aehr#67,
00NaX,4r1k1/1p2r3/p1p5/3p1p2/PP1P1q1p/2Q1P1pP/5PP1/4R1K1 w - - 0 39,e3f4 e7e1 c3e1 e8e1,433,92,78,284,endgame kingsideAttack master mate mateIn2 queenRookEndgame short,https://lichess.org/rZL4HlNU#77,
00Nay,r2q1r2/ppp2pk1/3p1n2/4p1p1/2B1P3/2NP2Q1/PPP5/2K4R b - - 0 19,g7g6 g3h3 f8h8 h3f5 g6g7 f5g5,1748,76,96,6438,crushing deflection long middlegame quietMove,https://lichess.org/wMvkJfcA/black#38,
00Nej,6k1/1p3pp1/pB2qb1p/2P5/1P6/6QP/4r1P1/3R3K b - - 4 33,f6e5 d1d8 g8h7 g3d3 e6g6 d3e2,1105,78,91,3087,crushing endgame fork long,https://lichess.org/P5XLEtLV/black#66,
00Nhl,5r1r/pR5p/k1ppb1n1/4p1Q1/N3P3/1P1P4/P1P3PP/6K1 w - - 1 23,b7h7 g6f4 g5f4 e5f4 h7h8 f8h8,2327,77,94,2022,advantage long middlegame,https://lichess.org/BEOTFmYh#45,
00Nih,8/3K4/8/5k1p/7P/8/8/8 w - - 1 62,d7e7 f5g4 e7e6 g4h4,1178,232,38,17,crushing endgame pawnEndgame short,https://lichess.org/uGsqUTBh#123,
00Nqd,8/p7/5P2/PP1bp3/4N3/K2p4/2k5/8 b - - 0 48,d3d2 e4d2 c2d2 b5b6 a7b6 a5b6,1765,76,99,213,crushing endgame long sacrifice,https://lichess.org/Mi2GPvfd/black#96,
00Nte,r4k2/8/2p3Bb/4p1n1/3q4/PQ6/2K2P2/1N4R1 w - - 3 30,g1g5 d4f2 b1d2 h6g5 b3f3 f2f3,1698,153,85,13,advantage intermezzo long middlegame,https://lichess.org/SO7vr4yL#59,
00Nua,8/1p1k2r1/p1p5/2P1R3/1P1pP3/P2r4/5RPK/8 w - - 1 31,a3a4 g7h7 h2g1 d3d1 f2f1 h7h1 g1h1 d1f1,1841,83,74,51,endgame,https://lichess.org/9qW9sLHW#61,
00O14,6k1/3P1pp1/4p3/p7/Q3R3/3q1PP1/1P3PK1/2r5 w - - 0 37,a4d4 d3f1 g2h2 f1h1,996,77,72,196,endgame mate mateIn2 short,https://lichess.org/IynnE0r9#73,
00O37,r1q1r1k1/1p3pp1/n1p4p/p1bpp2P/P3P3/2P2P2/1P1QBP2/R1BK3R b - - 3 23,c5f2 e2a6 b7a6 d2f2,1300,79,86,62,advantage discoveredAttack middlegame short,https://lichess.org/N2UAIb27/black#46,
00O3h,5k2/R3Rp2/6p1/1p5p/1P5K/2nr4/7P/8 b - - 7 43,d3d4 h4g5 c3e4 g5h6,1206,81,91,2214,crushing defensiveMove endgame short,https://lichess.org/71bhLvdU/black#86,
00O9Z,5QR1/5p1p/1b3qp1/p6k/P2P4/8/1P2rPPP/5RK1 w - - 7 32,g8h8 f6f2 f1f2 e2e1 f2f1 b6d4 g1h1 e1f1,1611,79,85,905,backRankMate deflection endgame fork master mate mateIn4 pin sacrifice veryLong,https://lichess.org/DKnGKRmQ#63,
00O9a,1k3r2/q5r1/2Qp3p/N2Bp3/4P1p1/P7/1PP2PPP/R5K1 w - - 12 35,a5c4 a7f2 g1h1 f2f1 a1f1 f8f1,985,88,91,728,backRankMate long mate mateIn3 middlegame sacrifice,https://lichess.org/t6wbqTty#69,
00OCQ,1rr3k1/5p1p/p5pQ/4p3/4q3/B3P3/PPPR1PPP/2KR4 w - - 6 27,c2c3 c8c3 b2c3 b8b1,937,80,98,1007,mate mateIn2 middlegame queensideAttack sacrifice short,https://lichess.org/kcUnWeDs#53,
00OKo,r3r1k1/pbq5/1p2pp1p/2p1N3/2PP2Q1/1P1B4/P5PP/R5K1 b - - 1 24,g8f8 a1f1 c7g7 f1f6 g7f6 e5d7,2331,79,78,77,advantage exposedKing long middlegame pin sacrifice,https://lichess.org/WuHXkAoT/black#48,
00ON5,8/k1p5/P7/3N4/3P2pp/3K2n1/6P1/8 w - - 1 47,d3e3 h4h3 e3f2 h3h2 f2g3 h2h1q,1812,75,87,133,advancedPawn crushing endgame knightEndgame long promotion,https://lichess.org/d71Ts3ff#93,
00OOp,5rk1/1bR3q1/pQ6/8/6r1/4R2P/P7/6K1 w - - 0 28,h3g4 g7g4 e3g3 g4g3,1053,91,86,85,endgame mate mateIn2 short,https://lichess.org/N1WcEYJH#55,
00OPc,1k1rr3/ppp1q3/8/4nQNp/8/2P4P/PP4P1/2K1R2R w - - 0 25,g5f3 e5d3 f5d3 d8d3 e1e7 e8e7,2116,76,100,201,advantage fork long middlegame,https://lichess.org/43yrfr28#49,
00OPi,5k2/5p1p/1p1P2p1/1B6/5P2/1P3KP1/n6P/8 w - - 0 38,f3e4 a2c3 e4d4 c3b5,630,82,98,430,advantage endgame fork master short,https://lichess.org/4K29qsm1#75,
00OPk,6rk/7p/R2N3P/1r6/1P5K/P7/8/8 b - - 4 50,b5d5 d6f7,816,103,93,914,endgame mate mateIn1 oneMove,https://lichess.org/aDJVIeGE/black#100,
00OQt,8/8/8/p3b3/P1B2pKp/1Pk1p2P/6P1/8 w - - 8 50,g4h4 c3d2 h4g4 e3e2 c4e2 d2e2,1663,75,88,359,advancedPawn bishopEndgame crushing endgame long,https://lichess.org/vZaFj9IE#99,
00OR6,2r4k/5Q1p/p7/1pq5/4p2N/2P3bP/PP4P1/4R2K b - - 0 34,g3e1 f7f6 h8g8 h4f5 c5f5 f6f5,2265,79,82,116,advantage endgame long quietMove,https://lichess.org/kMLJ7GPV/black#68,
00OXc,8/5K1p/1p4pk/8/3brp2/5R2/8/8 b - - 5 50,g6g5 f3h3,686,103,92,873,endgame master mate mateIn1 oneMove,https://lichess.org/Dp1LJyaZ/black#100,
00OYl,3r4/5p2/k3p1p1/2B1Pr2/2P3n1/1p3NPp/4QP1P/6K1 w - - 0 34,f3h4 f5e5 e2f1 e5c5,1959,99,100,20,crushing endgame fork short,https://lichess.org/es489ddj#67,
00Ocp,r3k3/p1pbq3/2p2p2/4p1p1/2B3p1/2P4r/P1P2PQP/3RR1K1 b q - 3 20,e7c5 g2e4 f6f5 e4e5 c5e5 e1e5,2098,145,73,19,crushing exposedKing long middlegame,https://lichess.org/fCyysDNm/black#40,
00Oim,1r3rk1/q5pp/2R5/3P4/8/1p2NpPb/1P3P1P/2QR2K1 w - - 0 32,c1c4 a7e3 f2e3 f3f2,1234,75,94,703,advancedPawn advantage middlegame sacrifice short,https://lichess.org/p1cFe6Z8#63,
00Oqz,5r2/7r/2kpqB1P/p1p1p2Q/P3P3/2PP4/5P1K/6R1 w - - 0 40,g1g6 f8f6 g6f6 e6f6,898,94,93,429,crushing endgame master short,https://lichess.org/OxaRmufB#79,
00Oyf,8/1p6/7p/3k1pp1/1P5P/3K1P2/6P1/8 w - - 0 39,h4g5 h6g5 d3c3 d5e5 c3c4 e5f4 c4c5 f4g3,2707,87,82,184,crushing endgame pawnEndgame veryLong zugzwang,https://lichess.org/eysZBqWU#77,
00Ozz,3kRr2/3n1B1p/2pP4/p1n5/Ppp5/8/1P3PPP/4R1K1 b - - 8 32,f8e8 e1e8,868,100,84,196,endgame mate mateIn1 oneMove,https://lichess.org/gO3w1uZJ/black#64,
00P45,3r1r2/p1p2p1k/1p2pPpp/7P/3qBQ2/8/PPP3P1/5R1K b - - 0 27,e6e5 h5g6 f7g6 f4g4 f8f6 f1f6 d4d1 g4d1 d8d1 h1h2,2420,96,90,42,advantage endgame veryLong,https://lichess.org/HlG7NGUO/black#54,
00P6j,r2n2k1/1bRq1rpp/1p6/3P4/p3Q3/B3P3/PP3PPP/3R2K1 b - - 0 20,d7c7 e4e8 f7f8 e8f8,1326,75,84,540,kingsideAttack mate mateIn2 middlegame short,https://lichess.org/vBpR18cI/black#40,
00P7n,r4rk1/p1p1R1pp/2p2p2/5P2/6Q1/1P5P/q5PK/8 b - - 1 30,a2b3 g4g7,1170,270,71,10,endgame mate mateIn1 oneMove,https://lichess.org/bFrOMLOq/black#60,
00P81,6k1/5p2/4p2p/3pPP2/1R5P/7r/2B5/2b2K2 b - - 0 46,h3c3 b4b8 g8h7 f5e6 c3c2 e6e7,2253,75,93,6870,advancedPawn crushing discoveredAttack endgame long sacrifice,https://lichess.org/SIETCqbJ/black#92,
