PuzzleId,FEN,Moves,Rating,RatingDeviation,Popularity,NbPlays,Themes,GameUrl,OpeningTags
00XNY,2r5/p4p1k/1p1pq3/2p2p2/7R/2Q4P/1P3PP1/6K1 b - - 1 34,h7g8 c3h8,491,94,79,112,endgame mate mateIn1 oneMove,https://lichess.org/eG661aPJ/black#68,
00XPO,r2q1r1k/1pp3p1/1b2b2p/3n4/pP6/P1P2N1P/1BB2PP1/R2QK2R w KQ - 0 20,d1d3 e6f5 e1c1 f5d3,1673,75,94,763,crushing middlegame short,https://lichess.org/ybuM6OK3#39,
00XPh,2br3k/5p1p/ppn2Np1/2b1q1P1/2P1p2N/P7/1PQ1B1K1/R4R2 w - - 6 27,c2c1 c5d6 c1f4 e5f4 f1f4 d6f4,2444,76,81,369,crushing long middlegame,https://lichess.org/8CP4mZnr#53,
00XQ8,k4r2/pp6/2p3Q1/3p2P1/4r2P/8/PPP2q2/2KR3R w - - 1 30,h1f1 f2e3 c1b1 f8f1 g6g8 e4e8,1551,75,93,1139,advantage discoveredAttack endgame long,https://lichess.org/bjvSXgAE#59,
00XTV,8/2k4p/p2p2p1/2pP1p2/2P4P/3K4/P2R1PP1/4r3 w - - 0 28,d2e2 e1e2 d3e2 c7b6 e2f3 b6a5 a2a3 a5a4,1571,75,94,10877,crushing endgame master rookEndgame veryLong,https://lichess.org/6kM7Fimp#55,
00XXM,3r1br1/Qpqk1p2/p1p1p2p/3nP3/8/2P1NP1N/PP6/1K1R3R b - - 3 25,f8e7 c3c4 b7b6 a7c7 d7c7 c4d5,1833,72,95,12492,advantage long middlegame pin,https://lichess.org/Pd55n9kL/black#50,
00XZR,8/2p5/p1n5/1pP1p2k/1P1p4/P2P3P/5P2/R4KRq b - - 9 34,h1h3 f1e2 e5e4 g1h1 e4d3 e2d2,1531,77,93,1174,crushing defensiveMove endgame long pin,https://lichess.org/cvl7Zq2b/black#68,
00XbN,6k1/R4p1p/6P1/3p4/8/2b5/1r2rBPP/5RK1 b - - 0 26,e2f2 g6f7 g8f8 a7a8,2126,82,92,2141,advancedPawn advantage endgame short,https://lichess.org/RsJhaWfC/black#52,
00Xfn,rn4k1/pp1q1r2/2pp2B1/3P4/2PB2b1/8/P2K1PP1/7R b - - 1 21,c6d5 h1h8,1382,86,75,327,mate mateIn1 middlegame oneMove,https://lichess.org/UcRGVasb/black#42,
00Xiu,8/pp3Q1p/1n2B1pk/8/6Pq/7P/PPP2P2/2K5 w - - 10 31,f2f4 h4e1,605,85,79,148,endgame mate mateIn1 oneMove,https://lichess.org/cVckB6RZ#61,
00Xn1,3r2k1/5pp1/2p3np/2b5/1p2P1b1/1BN3B1/1PP3PP/4KR2 w - - 0 21,c3a4 d8d1,685,91,100,209,master mate mateIn1 middlegame oneMove,https://lichess.org/GK88IOTY#41,
00XoP,6r1/p6k/1p4rp/3q1Q2/8/P7/4Rp1P/5R1K w - - 0 37,f5d5 g6g1 f1g1 f2g1q,686,89,76,66,advancedPawn endgame mate mateIn2 promotion queenRookEndgame short,https://lichess.org/KLJMqvTZ#73,
00Xp9,r2r2k1/p4ppp/1p6/N1p1n3/4n3/P3P3/1P2BPPP/1R1R2K1 w - - 0 20,a5c4 e5c4 e2c4 e4d2,1969,93,89,34,crushing master middlegame short,https://lichess.org/y5EZvhc9#39,
00Xr8,6k1/pp1n3p/2p1bppb/2q1p3/2P1P3/1PQN1PPP/PB4BK/8 b - - 5 25,c5e3 b2c1 e3d4 c3d4 e5d4 c1h6,1481,75,93,570,crushing long middlegame,https://lichess.org/mvexWrte/black#50,
00Y1c,5rk1/Q4p2/5p1p/2q5/8/8/P1r2PPP/3RR1K1 w - - 4 23,a7d7 c5f2 g1h1 f2g2,800,90,96,449,endgame mate mateIn2 short,https://lichess.org/T4YH4yAb#45,
00Y6y,5k2/5pp1/8/1p2N3/1P6/7P/3nR1P1/2r3K1 w - - 1 48,g1h2 d2f1 h2g1 f1g3 g1f2 g3e2,1220,76,92,522,advantage discoveredAttack endgame long,https://lichess.org/Rv29Dipi#95,
00YHj,5k2/1p6/8/4p2B/1R2Pp1p/3r1KpP/8/8 w - - 1 50,f3e2 d3e3 e2f1 f4f3 h5f3 e3f3,2104,83,91,8373,crushing endgame long,https://lichess.org/BqUcvzk5#99,
00YJz,8/ppp3p1/2nb1kB1/3r3R/4Q3/4PPq1/PP3K2/R1B5 w - - 3 24,f2f1 d5d1 f1e2 g3e1,1090,79,100,274,mate mateIn2 middlegame short,https://lichess.org/e8K57VIG#47,
00YYk,2kr2r1/1p1q3p/p1nb4/2p1p3/2N1R3/3P1QP1/PPP5/R1B3K1 b - - 4 22,d8f8 f3f8 g8f8 c4b6 c8c7 b6d7,2015,74,86,898,advantage fork long middlegame sacrifice,https://lichess.org/zIkElcfI/black#44,
00YbG,8/7p/3k2p1/p5P1/P2K4/8/8/8 b - - 4 47,d6c6 d4c4 c6d6 c4b5,1787,77,66,70,crushing endgame pawnEndgame short zugzwang,https://lichess.org/onsKQucl/black#94,
00YbZ,b6k/8/6p1/4q2p/1Q3r1P/P1N3R1/1PP3PK/8 w - - 3 35,b4b6 f4h4 h2g1 e5e1,1418,80,94,5346,endgame mate mateIn2 pin short,https://lichess.org/gzVgXweE#69,
00Ybq,2rr4/4kp2/p3p2q/1p3nNP/3PQP2/P1N5/1P3K2/6R1 b - - 0 34,d8d4 e4b7 d4d7 b7c8,1192,77,91,2085,crushing fork master middlegame short,https://lichess.org/TunHPHtZ/black#68,
00Ydr,r2qkb1r/p2p2pb/1p1PpN2/2p1Pp2/2P2P1P/4K3/PP2B1P1/3Q3R b kq - 2 21,g7f6 e2h5 h7g6 h5g6,1075,90,80,38,mate mateIn2 middlegame short,https://lichess.org/3hQsr2bX/black#42,
00Yfi,1Q6/5p1k/4b1pp/4RB2/3p2KP/6P1/P3q3/5r2 w - - 2 45,e5e2 e6f5,956,77,92,92,endgame mate mateIn1 oneMove,https://lichess.org/V9WbzUqF#89,
00Ygn,5rk1/p3Rp1p/5pp1/np1q4/r2P4/2P2N2/PQ3PPP/2R3K1 w - - 4 22,e7a7 a5c4 a7a4 c4b2,1508,74,90,662,crushing master middlegame short,https://lichess.org/B6LsArpZ#43,
00YhS,7K/8/8/5p2/4kP2/8/6P1/8 w - - 1 62,g2g3 e4f3 h8g7 f3g3 g7f6 g3f4,979,107,68,48,crushing endgame long pawnEndgame,https://lichess.org/JnQJMMAX#123,
00YhY,8/8/5kp1/R7/4p1P1/5p1P/2r2P2/6K1 w - - 0 52,h3h4 c2c1 g1h2 e4e3,1706,75,100,357,crushing endgame rookEndgame short,https://lichess.org/umv3Et1a#103,
00Yjy,6k1/5p1p/B2bp2q/5p2/6rP/1P4P1/1Q3P2/5R1K w - - 3 34,f1d1 g4h4 g3h4 h6h4 h1g2 h4g4 g2f1 g4d1,2001,77,73,82,crushing endgame exposedKing fork sacrifice veryLong,https://lichess.org/f0Kyo2Fh#67,
00YqR,5k2/p1p4p/1pPpBp2/2qP3b/8/2PQ4/P6P/7K w - - 0 33,d3h7 h5f3,903,76,100,489,endgame master mate mateIn1 oneMove,https://lichess.org/5b6k1W51#65,
00Yqw,1Qbk1b1r/4rpp1/p1BP3p/8/3q4/6P1/1PP3PP/1K5R b - - 0 33,e7d7 c6d7 d4c5 d7c8,1880,75,67,56,crushing middlegame pin short,https://lichess.org/bJncxL9v/black#66,
00Ytk,2k5/pp2PR2/2p4p/2Pp4/3Nb3/2K1P2r/PP6/8 b - - 0 33,h3e3 c3d2 e3d3 d2e2 c8d7 d4e6,2297,88,85,47,crushing defensiveMove endgame long,https://lichess.org/1sccsBa6/black#66,
00Yy4,r7/pp4kp/6p1/2P2q1n/1PBb1p2/P4P2/3B2PP/2Q1R1K1 w - - 1 28,g1h1 h5g3 h2g3 f5h5,993,78,100,115,clearance kingsideAttack mate mateIn2 middlegame sacrifice short,https://lichess.org/7Q7JGp9o#55,
00Z8S,8/5p2/4p1k1/4P3/8/1R4Pn/1P2Kp2/5N1r w - - 2 46,b3f3 h3g1 e2f2 g1f3,1313,145,50,17,crushing endgame fork short,https://lichess.org/9gYe3YHy#91,
00ZDZ,8/pp4k1/2p3p1/3nRr2/3P1Pp1/2P3K1/PP6/5R2 w - - 3 36,g3g4 f5e5 d4e5 d5e3 g4f3 e3f1,1720,75,96,6194,advantage endgame fork long,https://lichess.org/G2FHAUMb#71,
00ZEW,r1b5/pppqNkp1/3p3p/6rn/1PP2p1N/P5P1/4Q2P/4RRK1 b - - 3 22,g5e5 e2h5 e5h5 f1f4 f7e8 e7g6,2257,87,90,1778,advantage discoveredAttack long middlegame pin sacrifice,https://lichess.org/cjMxj5uZ/black#44,
00ZEc,1r3bk1/5p2/3P1qRP/r1n1p3/ppB5/P2Q1P2/1PP5/1K6 b - - 0 35,g8h7 g6g7 h7h6 d3h7,1800,76,96,18634,doubleCheck mate mateIn2 middlegame short,https://lichess.org/7IfLNNVB/black#70,
00ZN7,3q2k1/8/Q2p2p1/3P1p1p/1p2P1nP/1Pp5/2P3P1/5R1K w - - 0 36,e4f5 d8h4 h1g1 h4h2,889,79,97,835,endgame mate mateIn2 short,https://lichess.org/U0LXbVT4#71,
00ZPK,5r2/R2R1pk1/P7/5pp1/8/1KP5/5r2/8 b - - 0 44,g5g4 d7f7 f8f7 a7f7 g7f7 a6a7,935,99,94,1106,advancedPawn advantage endgame long master rookEndgame sacrifice,https://lichess.org/Y6yYxIcG/black#88,
00ZR6,8/1pr2pk1/3R1np1/6p1/p5Pn/1B2P2P/P3qP2/3R2KQ w - - 0 41,d6d2 h4f3 h1f3 e2f3,980,82,50,65,crushing fork master masterVsMaster middlegame short,https://lichess.org/CNWztPWJ#81,
00ZSZ,3r4/6pp/pNnNpk2/1p6/3pR3/8/PPP2PPK/8 w - - 4 32,e4f4 f6e5 d6f7 e5f4 f7d8 c6d8,1050,84,95,1100,advantage defensiveMove endgame long,https://lichess.org/66DBsV70#63,
00ZSd,2R5/5pk1/pb4p1/1p1q4/3P1P1p/P3r2P/1PQ3P1/3R2K1 w - - 6 45,g1h1 e3h3 h1g1 b6d4 d1d4 d5d4,1295,76,100,211,crushing endgame long pin,https://lichess.org/D5o6GOOI#89,
00ZWD,6k1/4bpp1/1q2p3/p2pP1N1/3P3P/1P1Q2K1/5P2/8 b - - 0 33,b6b4 d3h7 g8f8 h7h8,788,108,94,337,endgame mate mateIn2 short,https://lichess.org/2rMTqooF/black#66,
00ZcN,2rr1k1Q/1q2p1b1/p1b1P1p1/np3pP1/3P1B2/1P1B1N2/P2N4/2R1K2R b K - 0 27,g7h8 h1h8 f8g7 f4e5,1210,77,77,271,mate mateIn2 middlegame short,https://lichess.org/ElT6mnAJ/black#54,
00ZeT,1Q1k4/4r3/2q4p/2p1pp1P/2Bb4/1P6/P6K/4R3 b - - 4 43,d8d7 c4b5 c6b5 b8b5,1407,75,96,28563,crushing endgame pin short,https://lichess.org/c6iAy1Zc/black#86,
00Zks,8/P1R4p/5pk1/4q1p1/5P2/6KP/5QP1/7r b - - 0 51,e5c7 a7a8q c7c3 a8f3,1776,76,82,86,advancedPawn advantage defensiveMove endgame promotion short,https://lichess.org/CPhnVb98/black#102,
00ZvN,8/8/8/4kppp/8/4KPPP/8/8 b - - 0 35,f5f4 g3f4 g5f4 e3d3 e5f6 h3h4,2218,75,96,960,crushing defensiveMove endgame long pawnEndgame,https://lichess.org/IxlFLAaM/black#70,
00Zwc,r2k1r2/pp1nRR2/2pP1N1p/8/3P3p/8/PPP3P1/6K1 b - - 0 24,f8f7 e7e8,1211,75,92,788,endgame mate mateIn1 oneMove,https://lichess.org/Wo9Y7MdP/black#48,
00a98,4r1k1/p4p2/1p3q1p/1P6/3b2p1/P3B1P1/Q1P2PKP/4R3 w - - 0 32,e3d4 f6f3 g2f1 f3h1,1531,82,90,31,endgame mate mateIn2 short,https://lichess.org/pgdIGRB3#63,
00aDl,r5k1/1p3p2/2p1ppp1/3p4/2nP4/1QB2B1P/rPP2PP1/qNKR3R w - - 3 22,f3e2 a1b1 c1b1 a2a1,1375,71,95,32423,attraction mate mateIn2 middlegame queensideAttack sacrifice short,https://lichess.org/pc79SSEd#43,
00aL1,8/5pr1/1Q4k1/p2pp3/5Rp1/6P1/5PKP/3q4 b - - 1 33,g6h7 f4f5 d1f3 f5f3,2010,80,66,61,advantage endgame short,https://lichess.org/UKybXdi1/black#66,
00aNB,8/8/pp3k1K/2p4P/P7/2P5/8/8 w - - 0 44,h6h7 c5c4 h7g8 f6g5 g8f7 b6b5 a4b5 a6b5 f7e6 b5b4,2229,148,39,23,crushing endgame pawnEndgame quietMove veryLong,https://lichess.org/yR9wiOTR#87,
00aOF,3r2k1/pp5p/5pbQ/q2p4/6PP/1Br2P2/P1P5/4RRK1 w - - 0 24,e1e7 a5c5 f1f2 c5e7,1195,86,93,101,advantage fork middlegame short,https://lichess.org/9tRSkE9Q#47,
00aYp,2rq1rk1/p1n1bp2/1p2p1pN/3nP2p/3P3P/P2Q1N2/1P4P1/RBB3K1 b - - 1 21,g8g7 h6f7 f8f7 d3g6,1722,77,69,86,crushing master middlegame short,https://lichess.org/AaaUgm4I/black#42,
00aZ3,8/6k1/1n6/1K2p1p1/P5P1/1B3r2/1PP5/8 b - - 1 36,b6d5 b3d5 f3f4 a4a5 e5e4 a5a6 e4e3 a6a7,2049,81,88,739,advancedPawn crushing endgame hangingPiece quietMove veryLong,https://lichess.org/0yMvFk5C/black#72,
00aa9,6k1/7p/6p1/5p2/5PP1/7P/1p6/1K6 w - - 0 42,b1b2 f5g4 h3g4 h7h5 g4h5 g6h5,1923,77,100,299,crushing endgame long pawnEndgame,https://lichess.org/AEsi0Sed#83,
00afi,3r2k1/1p5p/pbbqpr2/3PR3/P5p1/2B2N1P/1PQ2P1P/3R3K b - - 0 26,f6f3 e5g5 g8f8 c2h7 d6h2 h1h2 f3h3 h7h3,2067,78,94,1645,crushing deflection middlegame veryLong,https://lichess.org/VcPyc8y8/black#52,
00agR,8/5pp1/p4n1p/1p2k3/8/1PK1P3/P1B2P1P/8 w - - 2 31,h2h3 f6e4 c2e4 e5e4,1997,76,95,3856,crushing endgame short,https://lichess.org/MUIpGzM3#61,
00all,6k1/5ppp/4p1b1/1N1pP3/1P1n4/r7/5PPP/2R2BK1 b - - 0 25,d4b5 c1c8,436,105,95,236,backRankMate endgame mate mateIn1 oneMove,https://lichess.org/84IXBueE/black#50,
00asK,2r3k1/R4ppp/8/4P3/4Q3/1qn3B1/5PPP/2R3K1 w - - 0 30,c1c3 b3d1 e4e1 d1e1,1447,84,36,94,endgame mate mateIn2 short,https://lichess.org/hlWKSG6i#59,
00au3,4B3/8/1p1k1p1p/5Pp1/p1P3P1/1nK4P/1P6/8 b - - 9 48,d6c5 e8a4 b3c1 b2b4,1188,82,90,458,crushing endgame master masterVsMaster short,https://lichess.org/yPpeNCSO/black#96,
00awK,r5k1/2p2Qpp/p7/4b3/8/8/1PP1KR2/2q5 b - - 0 24,g8h8 f7f8 a8f8 f2f8,586,85,100,263,backRankMate endgame mate mateIn2 sacrifice short,https://lichess.org/D9JaNyrl/black#48,
00awL,4q1r1/k2r1Rp1/ppp4p/2Qp4/3P4/2P1P3/PP4P1/2K2R2 w - - 0 35,c5c6 d7f7 f1f7 e8f7,1739,74,88,165,crushing endgame short,https://lichess.org/TPaROV8B#69,
00ax2,r1b2q1k/1pp3p1/1b1p3p/1p5Q/P1P1Bp2/3P4/6PP/5R1K b - - 1 23,f8f6 h5e8 f6f8 e8f8,873,147,100,22,kingsideAttack mate mateIn2 middlegame short,https://lichess.org/zZGnME4m/black#46,
00b6f,6k1/8/5B2/1R3pK1/6p1/6P1/P4P1q/8 w - - 0 41,g5f5 h2h5 f6g5 h5f7 f5g4 f7c4,1749,87,77,41,crushing endgame long,https://lichess.org/8DcVY76B#81,
00b7t,r2qr1k1/pb3pp1/1p4n1/3p4/1P2p2p/P1P1N1P1/2Q1PPBP/3R1RK1 w - - 0 20,g2e4 e8e4 c2e4 d5e4 d1d8 a8d8,1462,77,96,9178,advantage long middlegame,https://lichess.org/USUzRjja#39,
00bFH,4r1k1/1q3ppp/3B1n2/p2P4/8/Pp3Q1P/5PPN/1R4K1 w - - 0 27,f3b3 e8e1 b1e1 b7b3,1594,134,100,50,deflection equality middlegame short,https://lichess.org/E8lzVecv#53,
00bGq,1k3r2/ppp2r1p/1b1pQP1p/8/3P3P/2P3R1/Pq4P1/5R1K b - - 0 22,b2b5 e6f7 b5f1 h1h2 f8c8 f7e6,2693,117,87,172,advantage long middlegame,https://lichess.org/GVwrEInE/black#44,
00bJi,7k/1p2R3/p3N3/3p4/2n5/2P5/PPK4r/8 w - - 3 36,c2d3 h2d2,1615,76,95,1801,endgame hookMate mate mateIn1 oneMove,https://lichess.org/7QIgY2UO#71,
00bPT,2k2Q2/pp2pp2/3p1n2/2pP4/2P1P3/2q2PK1/8/5B2 b - - 1 33,c8d7 f1h3 d7c7 f8e7,1965,78,91,287,advantage deflection endgame short,https://lichess.org/SC9ZvmmO/black#66,
00bQA,r7/6k1/2b1R1n1/1p3nR1/1P1p3p/3P1PpP/2N3P1/6K1 b - - 0 40,f5e7 e6e7 g7f6 g5g6 f6e7 g6c6 e7d7 c6c5,2230,78,87,603,crushing exposedKing master middlegame pin skewer veryLong,https://lichess.org/1NlzMdB5/black#80,
00bSy,1kr1r3/1pp4p/p2b2p1/3N1p2/P7/3P1Q1P/2R2PP1/2R1q1K1 w - - 7 27,c1e1 e8e1,548,92,83,368,kingsideAttack master mate mateIn1 middlegame oneMove,https://lichess.org/s7Pa0Pux#53,
00bTb,7R/kppq2r1/p3p3/3p4/P2P4/BPr5/1KP5/5Q2 b - - 1 33,c3g3 f1f8 g7g8 h8g8 g3g8 f8g8,1974,206,76,9,advantage endgame long,https://lichess.org/3tgXxOlJ/black#66,
00bTs,2r4k/6bP/8/3p4/pp1qn3/3N1Q2/PPP3R1/1K5R w - - 5 35,g2g7 e4d2 b1a1 d2f3,1042,83,94,991,advantage fork master middlegame short,https://lichess.org/PDAfQk7l#69,
00bWA,2r1r1k1/3qbppp/pB6/3ppP2/2p1Q3/P6P/BPP3P1/R4RK1 w - - 0 22,e4e5 e7c5 e5d4 c5d4,1024,85,90,365,crushing middlegame short,https://lichess.org/JvdmqrAX#43,
00bZ2,4b1k1/1r2P2p/p1p3pP/6q1/3Q4/PB6/1PP3P1/1K6 b - - 0 36,b7b3 d4g7,1106,84,85,178,endgame mate mateIn1 oneMove,https://lichess.org/PL5NKKII/black#72,
00baZ,r7/8/p1k5/1p1p1pn1/3R3p/2P1P2P/5P2/R5K1 w - - 0 31,d4h4 g5f3 g1g2 f3h4,812,89,88,400,crushing endgame fork short,https://lichess.org/tNXaI1nN#61,
00bgO,8/8/1p1nk3/p2N4/2P1p3/PP2K3/8/8 b - - 4 46,e6d7 d5b6 d7c6 b6a4,2409,77,76,142,crushing defensiveMove endgame knightEndgame master short,https://lichess.org/kVsJ1quC/black#92,
00bhw,8/2pR3p/1p1b3k/p2B2pP/P1P2rP1/5P2/4r3/5R1K b - - 0 31,f4d4 d5e4 d4e4 f3e4,2175,81,90,677,crushing endgame short,https://lichess.org/CVsMMWzy/black#62,
00blC,5r2/1Pk5/8/K7/8/1P3B2/8/8 w - - 1 47,f3d5 f8f5 b7b8b c7b8 a5b5 f5d5,1027,81,84,51,crushing endgame long pin,https://lichess.org/IdlWudUv#93,
00bns,5nk1/1pp2ppp/p5q1/4PN2/2P2Q2/1P1rBP1P/r4P1K/4R3 b - - 5 30,f8e6 f5e7 g8f8 e7g6,959,131,68,39,crushing fork master middlegame pin short,https://lichess.org/qMrSgl2S/black#60,
00bnu,2r2rk1/2QR1p1p/p3p1p1/1p4q1/5P2/P1N5/BPP3bP/2K4R w - - 1 20,c7c8 g5f4 c1b1 f8c8,1575,77,88,3253,advantage intermezzo middlegame short,https://lichess.org/zPFxVXT4#39,
00bpH,8/5p2/pq5p/1p5k/6B1/6P1/P6P/2Q4K b - - 0 36,h5g4 c1f4 g4h5 f4f5,1854,76,63,532,endgame mate mateIn2 queenEndgame short,https://lichess.org/vVLXcQQI/black#72,
00bqJ,r7/1pp4k/p2p3p/3Ppq2/2P2bb1/1N2R3/PP1Q4/1K1N2R1 w - - 8 27,d2c2 f5c2 b1c2 g4d1 g1d1 f4e3,1939,76,95,1606,advantage attraction long middlegame queensideAttack,https://lichess.org/FMvI8Grp#53,
00bri,2r4k/p4p1p/b4p2/8/4P2P/1Pqr1QP1/P4PB1/2RR2K1 b - - 1 25,c3c1 f3f6 h8g8 d1c1,1803,84,80,34,advantage fork intermezzo middlegame short,https://lichess.org/KPxWYsgw/black#50,
00byq,2r3k1/2r1bppp/3ppn2/qp6/3BP3/1Q4P1/PP3PBP/1RR3K1 w - - 5 21,d4e3 c7c1 b1c1 c8c1 e3c1 a5e1 g2f1 e1c1,998,93,93,551,advantage fork middlegame pin veryLong,https://lichess.org/gofuvC2L#41,
00bzC,r1r3k1/2p3p1/p2p3p/Pp1Pp3/4P3/3P1p1q/R1Q2P1N/4R1K1 w - - 0 28,g1h1 h3g2,850,78,82,68,mate mateIn1 middlegame oneMove,https://lichess.org/VwQi9pgI#55,
00bzy,4k1r1/p1p5/2P4p/3rNp2/1b1BnP1p/4PR1P/P6K/1R6 b - - 1 27,e4d2 b1b4 d2f3 e5f3,1511,86,84,60,advantage middlegame short,https://lichess.org/hR3zgrkT/black#54,
00c89,2r2rk1/6pp/p1q5/1pn2p2/1B1pPP2/3Pn1QB/1PP2R1P/6RK b - - 3 24,f8f6 g3g7,400,99,55,318,kingsideAttack master mate mateIn1 middlegame oneMove,https://lichess.org/qy4azPDa/black#48,
00cRN,8/4rkb1/R5R1/5P1p/P6P/4p1P1/1r6/4K3 b - - 0 44,e3e2 g6g7 f7g7 f5f6 g7f7 f6e7,1726,75,79,396,advancedPawn advantage attraction endgame exposedKing fork long sacrifice,https://lichess.org/mwg2d74x/black#88,
00cSF,r1b3k1/pp3p1p/6q1/2pp1r2/8/P1P1PQ1P/1P3PP1/RN3R1K w - - 7 19,f3g3 g6g3 f2g3 f5f1,774,83,86,149,crushing kingsideAttack middlegame short,https://lichess.org/57UdP92X#37,
00cZ4,8/2R5/6pk/p3p2p/4Nq2/5n1P/P2R2P1/7K w - - 0 41,d2f2 f4h2,1056,80,87,205,endgame master mate mateIn1 oneMove,https://lichess.org/uEKnkWhW#81,
00cZE,4k3/5p2/3r4/pRp3Pp/2P1p3/6P1/1KP4P/8 w - - 0 31,b5c5 e4e3 g5g6 e8f8 c5a5 e3e2,2591,89,75,58,advancedPawn crushing endgame long rookEndgame,https://lichess.org/GXkr4U3u#61,
00ct0,4rrk1/pp4pp/2p1b3/4q3/4Bb2/1PPQ4/P4PP1/R1B2R1K w - - 3 22,c1f4 f8f4 e4h7 g8h8 h1g1 f4h4 f2f4 e5c5,2232,77,86,182,crushing middlegame veryLong,https://lichess.org/LbmI3g6K#43,
00cud,8/5p2/6p1/1p1N1k2/1PbK4/2P3P1/8/8 b - - 0 48,c4f1 d5e3 f5e6 e3f1,926,81,97,1983,crushing endgame fork master short,https://lichess.org/XdT6vR6T/black#96,
00cxG,2r5/3RQ2p/6pk/8/5q1P/1P6/2K5/8 w - - 16 42,c2b2 f4c1 b2a2 c8c2,2038,90,60,68,endgame mate mateIn2 short,https://lichess.org/qctk0UXT#83,
00cy1,2rknb2/3q1pp1/p1pP3r/1pQ1P2p/5P2/1P4P1/PB4K1/3R4 b - - 0 27,h5h4 c5b6 e8c7 d6c7,1180,76,95,808,advancedPawn advantage master middlegame pin short,https://lichess.org/TsSnBR0S/black#54,
00d4c,3r3k/p1p3p1/1p3q1p/4b3/2P1p3/1P2B1P1/P3QPKP/1R6 w - - 0 29,b1d1 f6f3 e2f3 e4f3 g2f3 d8d1,1650,76,92,545,advantage endgame long master,https://lichess.org/LptJDQcB#57,
00d5g,2b2rk1/pp4p1/2p5/4r3/2B5/1P6/P4pK1/5R2 b - - 4 32,g8h8 f1h1 c8h3 h1h3 e5h5 h3h5,1090,84,85,618,endgame long mate mateIn3,https://lichess.org/Vf4zaDk5/black#64,
00d9q,1r1q1r2/Q2k3p/2pp1npb/2p2P2/8/2N5/PP3PPP/4RRK1 b - - 0 19,d8c7 e1e7 d7e7 a7c7,1093,83,94,910,attraction crushing deflection master middlegame short,https://lichess.org/kbUk4cWh/black#38,
00dRh,1q5k/1b2Q1pp/pb3p2/1p6/1P2P3/PB3n2/5P1P/3RR1K1 w - - 0 25,g1g2 b8h2 g2f3 h2f2,1866,77,92,1449,crushing middlegame short,https://lichess.org/QvxqC3Zg#49,
00dTO,5q2/5rk1/3p1np1/p1p5/1pP2NP1/3PNp1P/PP5K/3Q4 b - - 1 30,f6d7 f4e6 g7g8 e6f8,810,98,95,2186,crushing endgame fork short,https://lichess.org/AQ7wJCy0/black#60,
00dTd,3r4/ppp1Q3/1b2kP2/8/4qp2/P1Pr4/1P3P2/1K2N3 b - - 5 31,e6d5 e7d8 d5c6 e1d3,2020,78,92,981,advantage endgame hangingPiece short,https://lichess.org/UVi7iEcB/black#62,
00dUW,4k2r/1pb3pp/p4p2/2P1p2b/1PBn4/P3N1P1/3B1P1P/5RK1 w k - 3 23,e3d5 d4f3 g1g2 f3d2,1251,78,85,194,crushing fork middlegame short,https://lichess.org/RnKoYsGf#45,
00dWq,2r1kb2/5p1p/p3p3/1p2P1Q1/1Pq5/P1p3P1/2P4P/2KR1R2 w - - 0 28,g5f4 f8h6 c1b1 h6f4,2190,75,93,2977,advantage endgame pin short,https://lichess.org/sRKDDbRV#55,
00dnp,8/Q7/7r/8/6K1/1r2k1p1/6P1/8 b - - 2 64,e3e2 a7a2 e2e3 a2b3,1280,77,94,22943,crushing endgame fork master queenRookEndgame short,https://lichess.org/hMbf0KPM/black#128,
00dpQ,6k1/5ppp/8/4rP2/1r4P1/2RK3P/8/7B b - - 0 47,b4b5 c3c8 e5e8 c8e8,570,108,81,553,backRankMate endgame mate mateIn2 short,https://lichess.org/8DGDxXX7/black#94,
00dqP,r1b2rk1/5p1p/p3pP2/1p1p4/5q1n/1P5P/P1P1QPB1/1K1R2R1 b - - 2 21,f4f6 g2d5 h4g6 d5a8,1662,75,94,5221,advantage discoveredAttack middlegame short,https://lichess.org/6NRhzen2/black#42,
00dt1,Q7/8/3B4/2p5/Krkn4/8/8/8 w - - 1 54,a4a3 d4b5 a3a2 b5c3 a2a1 b4b1,2196,83,95,13484,arabianMate endgame exposedKing fork long master mate mateIn3,https://lichess.org/AQkAsoMX#107,
00dwJ,2r5/2r3k1/p1q1b1pp/3pn3/3R4/4P1N1/PQ4PP/R5K1 b - - 7 32,c6c1 a1c1 c7c1 g3f1,1823,75,95,5816,advantage defensiveMove middlegame short,https://lichess.org/jAiL6A2t/black#64,
00dyB,2rq1r2/4pBkp/pn1P1bp1/1p2N3/3PR3/P4Q2/1P3PPP/3R2K1 w - - 1 25,f7e6 f6e5 d6e7 d8e7 f3e3 e7e6,1892,75,83,209,advantage long master middlegame,https://lichess.org/DAndMjSb#49,
00dzT,6k1/1Q4p1/p1p4p/3pP3/P3bq2/2N4P/1P4PK/5B2 w - - 1 26,h2h1 f4f1 h1h2 f1g2,950,77,100,169,endgame hangingPiece mate mateIn2 short,https://lichess.org/Kxd5ijdt#51,
00dzs,3k1b1r/1p1n1ppp/1B6/1p6/8/5K2/PPr2PPP/3RR3 b - - 1 19,d8c8 e1e8,839,104,91,286,mate mateIn1 middlegame oneMove,https://lichess.org/zvBG4Lv4/black#38,
00e5u,2r2r2/1p2k1p1/p5p1/P1P3N1/3bPBpP/3K2P1/2P5/7R b - - 0 29,f8d8 f4d6 d8d6 c5d6 e7d6 d3d4,1481,83,81,59,crushing endgame exposedKing long master,https://lichess.org/n153s8Fx/black#58,
00e6J,r5k1/pb2r1p1/1p2pQ2/2b1N3/5P2/PP5P/4p2K/3R2R1 w - - 0 33,d1e1 c5g1 e1g1 e2e1q f6e6 e7e6,1661,74,91,201,advancedPawn advantage long middlegame promotion,https://lichess.org/S92jnNLj#65,
00e6Q,5r2/pppk2pp/3p1r2/8/3PPn2/2P2PQq/PP2B2P/R3KR2 b Q - 2 21,h3g3 h2g3 f4e2 e1e2,1549,74,89,199,advantage middlegame short,https://lichess.org/21HTWoxt/black#42,
00e7H,8/7p/p1p4k/1p1p4/3Qpq2/2P2NpP/PP4K1/8 w - - 0 44,f3d2 c6c5 d4c5 f4d2,1930,76,94,12709,advantage deflection endgame master masterVsMaster short,https://lichess.org/DTE43D0V#87,
00eAX,6k1/ppprN1pp/8/8/2r5/2P5/P5PP/3R1RK1 b - - 5 26,d7e7 d1d8 e7e8 d8e8,745,84,98,854,endgame mate mateIn2 rookEndgame short,https://lichess.org/MrdsMkpV/black#52,
00eB8,4rb2/2p1q2k/p1Pp2p1/1p1Q3p/7P/2P2R2/PP4P1/1K6 b - - 1 34,f8h6 f3f7 h6g7 f7e7,965,85,96,2762,advantage endgame fork short,https://lichess.org/KYL3UuaC/black#68,
00eC6,2kr4/1p3p2/1P6/Q1ppP3/3NnPqp/8/P5KP/2R1R3 w - - 1 29,g2h1 e4f2,988,128,83,21,master mate mateIn1 middlegame oneMove,https://lichess.org/Z0Kq2Ar8#57,
00eCY,8/6p1/5p1p/R5kP/2b3P1/1r3PK1/8/8 b - - 4 61,c4d5 a5d5 f6f5 d5f5,755,83,88,487,endgame hangingPiece mate mateIn2 short,https://lichess.org/LXHmo9rD/black#122,
00eF9,8/8/Rp1r4/2p5/P1P1kp2/1P6/4K3/8 w - - 2 57,a4a5 f4f3 e2f2 d6d2,1201,81,91,63,crushing endgame master rookEndgame short,https://lichess.org/JdY4zfQY#113,
00eGd,7R/8/p2kp3/2r4p/p4K2/6PP/P7/8 b - - 3 39,d6d5 h8h5 e6e5 h5e5,1273,76,93,2781,crushing endgame rookEndgame short,https://lichess.org/uwded1rg/black#78,
00eGy,8/6k1/pp2p3/3pPpp1/PPpP1n2/2P3KP/2R5/8 w - - 2 39,h3h4 f4h5 g3f2 g5g4,2277,78,81,128,advantage defensiveMove endgame master short,https://lichess.org/6A7qLhc2#77,
00eLW,8/8/3q3k/5Q2/4p3/4P2P/5pK1/8 w - - 0 42,f5f4 d6f4 e3f4 e4e3,1046,79,88,1249,crushing endgame queenEndgame short,https://lichess.org/jhaADLF2#83,
00eNe,4r1k1/p1p2ppp/2p1r3/3q4/P2b4/1P1PB3/2Q2PPP/2R1R1K1 w - - 0 21,e3d4 e6e1 c1e1 e8e1,903,77,100,186,kingsideAttack mate mateIn2 middlegame short,https://lichess.org/uH5mJi23#41,
00eOw,r2r2k1/pp3pp1/5q1p/4p3/3p4/2N1P3/PPQ2P1R/2K4R w - - 0 25,e3d4 e5d4 c1b1 d4c3,1652,74,87,108,crushing middlegame short,https://lichess.org/QAjxFUBC#49,
00eQx,5r1k/R5bp/6p1/p2Bq3/p3P3/6PK/7P/4Q3 w - - 7 39,a7a5 e5h5 h3g2 h5f3,1225,79,94,1101,crushing endgame short,https://lichess.org/fhgCrd1k#77,
00eSU,5r2/p2R4/1p3pk1/PQ4p1/4p1q1/4P1P1/6PK/8 w - - 3 34,a5b6 f8h8 h2g1 g4g3,1996,77,88,172,crushing deflection endgame short,https://lichess.org/RCXs5UcQ#67,
00eWz,4r1k1/p5bp/1q4p1/2pPrp2/1pP2N2/6PP/P4QB1/1R3RK1 w - - 2 25,f4e6 e5e6 d5e6 g7d4,1597,76,92,5222,advantage clearance master middlegame pin sacrifice short,https://lichess.org/T1YYoy2O#49,
00eXL,8/8/3RP3/p1Pn4/1pN1k2p/8/rP1K4/8 b - - 0 40,a5a4 d6d5 e4d5 e6e7,1659,75,84,135,advancedPawn advantage endgame sacrifice short,https://lichess.org/MBrW6WzK/black#80,
00eae,2r3kr/1pq1b1p1/p1n1p1P1/3p1pB1/3P3p/P3Q3/1PP1N3/1K4RR b - - 4 26,e7g5 e3e6 g8f8 g1g5,1780,75,93,566,crushing intermezzo kingsideAttack master middlegame short,https://lichess.org/MLbXS3BJ/black#52,
00eak,4r1k1/5pp1/5n1p/P5r1/7q/1QP1p1PP/1P3P2/R3RBK1 w - - 0 27,g1h2 f6g4 h2g2 g4f2,1937,75,92,2099,crushing middlegame pin short,https://lichess.org/FQ3hbxjY#53,
00eix,2r1r1k1/pb2qpbp/1p1p1np1/4P3/3B1P2/1P3BP1/PQ1N3P/1R2R1K1 b - - 0 21,b7f3 e5f6 e7e1 b1e1 e8e1 g1f2,1439,78,83,1475,crushing fork long middlegame,https://lichess.org/g5Z6vAB2/black#42,
00f2T,4r2k/p7/3p4/2pPbr1p/2P1RR2/2B3qP/P3Q3/7K w - - 1 33,f4f5 g3h3 h1g1 e8g8,1865,78,93,597,crushing fork middlegame short,https://lichess.org/XytFAWBD#65,
00f99,6k1/p4p2/1p5R/3r2p1/1P2b1P1/P3B2P/5P2/6K1 w - - 1 35,h6h5 d5d1 g1h2 d1h1 h2g3 h1g1,1094,80,82,60,advantage endgame long,https://lichess.org/2eLSy15i#69,
00f9k,1b1r2k1/4pp1p/p1N3p1/1p6/8/PP2BN1P/6P1/6K1 b - - 0 27,d8c8 c6e7 g8f8 e7c8,853,91,86,78,crushing endgame fork short,https://lichess.org/IGibUvcX/black#54,
00f9v,5rk1/2p3p1/1p1p4/3Pp2p/1PP1N1q1/3Qr2N/6PP/6K1 w - - 0 29,d3e3 g4d1 e3e1 d1e1,801,79,100,169,endgame mate mateIn2 short,https://lichess.org/WHRVbLDr#57,
00fA6,2r3k1/p4p1p/Pn2p1p1/2rpP1P1/5P2/4B1P1/2P4R/R6K b - - 2 28,c5c2 h2c2 c8c2 e3b6 a7b6 a6a7,1841,77,83,69,advancedPawn crushing endgame long,https://lichess.org/eOhm3Aud/black#56,
00fDM,3rrbk1/2p3R1/1p2q2Q/3p4/1P6/2B4P/6P1/3R2K1 b - - 0 33,f8g7 h6g7,885,83,99,675,mate mateIn1 middlegame oneMove,https://lichess.org/sx01PyS8/black#66,
00fJC,1r6/6p1/5p1p/r1kp4/Pp3q2/2pR3P/2Q2PP1/3R2K1 b - - 4 39,b8d8 d3c3 b4c3 c2c3 c5d6 c3a5,1756,75,92,551,advantage endgame fork long sacrifice,https://lichess.org/PmojFttS/black#78,
00fN7,N1bk4/pp1p1R2/5bB1/4p3/4n3/8/PB2r3/2K5 b - - 5 24,e2f2 f7f8 d8e7 f8e8 e7d6 g6e4 f2b2 c1b2,2361,82,77,78,advantage fork middlegame veryLong,https://lichess.org/hpYXRUS4/black#48,
00fVJ,8/5pkp/PQ4p1/4p3/RP1pP3/8/2rq1PPP/5BK1 w - - 0 36,b6b5 d2f2 g1h1 c2c1,1409,240,82,13,crushing endgame short,https://lichess.org/Y0F35PWK#71,
00fXd,8/Q5b1/p2kp3/1p2qpN1/1P6/P7/4nPP1/5K2 b - - 5 46,d6d5 a7c5,1502,77,94,2534,endgame master mate mateIn1 oneMove,https://lichess.org/PkmRzeiI/black#92,
00fXf,6k1/5p2/3bbq2/p2p2pp/N2Pn3/P3PN1P/4BPP1/2Q3K1 w - - 0 31,a4c5 d6c5 d4c5 g5g4,2280,77,90,874,advantage master middlegame short,https://lichess.org/1Sr4mXWb#61,
00fZM,5rk1/1q3r1p/3p2RQ/3p4/3B4/2P2P2/P5PP/6K1 b - - 0 30,h7g6 h6h8,981,79,96,2519,endgame mate mateIn1 oneMove,https://lichess.org/F6b275RM/black#60,
00fba,3r2k1/p3qp1p/6p1/P7/3r4/2Q4P/n4PP1/1RR2BK1 w - - 2 31,c3c7 d4d7 c7c5 a2c1 c5e7 d7e7,1985,75,93,7482,crushing long master middlegame,https://lichess.org/PuG50RPy#61,
00fgg,4r1k1/p4ppp/8/8/8/8/PP1b1PPP/K2R4 w - - 0 21,d1d2 e8e1 d2d1 e1d1,589,93,63,193,backRankMate endgame mate mateIn2 rookEndgame short,https://lichess.org/AjVJZKD1#41,
00fky,5rk1/ppqb1p1p/2p2Bp1/3p4/8/2P2Q2/PP3PPP/4R1K1 b - - 0 19,f8e8 e1e8 d7e8 f3e3 c7d6 e3e8,1953,75,93,1383,advantage endgame kingsideAttack long,https://lichess.org/XuK4pm8q/black#38,
00fld,3R4/5kpp/8/p2p1p2/r2P4/2p1P2P/2Rn1PP1/6K1 w - - 0 44,d8d5 a4a1 g1h2 d2f1,1305,295,43,5,crushing endgame short,https://lichess.org/RmV6CwE1#87,
00fmc,1r1r2k1/2p3b1/p1q4p/3pP1pb/P2B1p2/1B3P2/1P4PP/R2QR1K1 w - - 7 29,e5e6 g7d4 d1d4 b8b3,1545,75,92,1827,advantage middlegame short,https://lichess.org/KIWMqJFV#57,
00ft3,8/p7/2R3p1/4Nnk1/2P4p/7K/Pr6/8 b - - 3 50,g5f4 e5d3 f4g5 d3b2,1264,79,86,827,crushing endgame fork short,https://lichess.org/CFT5b92o/black#100,
