PuzzleId,FEN,Moves,Rating,RatingDeviation,Popularity,NbPlays,Themes,GameUrl,OpeningTags
00008,r6k/pp2r2p/4Rp1Q/3p4/8/1N1P2R1/PqP2bPP/7K b - - 0 24,f2g3 e6e7 b2b1 b3c1 b1c1 h6c1,1800,77,95,8421,crushing hangingPiece long middlegame,https://lichess.org/787zsVup/black#48,
0000D,5rk1/1p3ppp/pq3b2/8/8/1P1Q1N2/P4PPP/3R2K1 w - - 2 27,d3d6 f8d8 d6d8 f6d8,1492,74,96,33381,advantage endgame short,https://lichess.org/F8M8OS71#53,
0008Q,8/4R3/1p2P3/p4r2/P6p/1P3Pk1/4K3/8 w - - 1 64,e7f7 f5e5 e2f1 e5e6,1340,77,91,726,advantage endgame rookEndgame short,https://lichess.org/MQSyb3KW#127,
000Pw,6k1/5p1p/4p3/4q3/3nN3/2Q3P1/PP3P1P/6K1 w - - 2 37,e4d2 d4e2 g1f1 e2c3,1425,77,100,168,crushing endgame fork short,https://lichess.org/au2lCK5o#73,
000VW,r4r2/1p3pkp/p5p1/3R1N1Q/3P4/8/P1q2P2/3R2K1 b - - 3 25,g6f5 d5c5 c2e4 h5g5 g7h8 g5f6,2854,107,85,257,crushing endgame long,https://lichess.org/e9AY2m5j/black#50,
000Vc,8/8/4k1p1/2KpP2p/5PP1/8/8/8 w - - 0 53,g4h5 g6h5 f4f5 e6e5 f5f6 e5f6,1615,79,75,106,crushing endgame long pawnEndgame,https://lichess.org/l6AejDMO#105,
000Zo,4r3/1k6/pp3r2/1b2P2p/3R1p2/P1R2P2/1P4PP/6K1 w - - 0 35,e5f6 e8e1 g1f2 e1f1,1353,75,86,631,endgame mate mateIn2 short,https://lichess.org/n8Ff742v#69,
000h0,5rk1/p5p1/3bpr1p/1Pp4q/3pR3/1P1Q1N2/P4PPP/4R1K1 w - - 4 22,e4e6 f6f3 g2f3 h5h2 g1f1 h2h3 f1e2 h3e6,1930,137,100,7,advantage interference kingsideAttack middlegame veryLong,https://lichess.org/OWe6M5dF#43,
000lC,3r3r/pQNk1ppp/1qnb1n2/1B6/8/8/PPP3PP/3R1R1K w - - 5 19,d1d6 d7d6 b7b6 a7b6,1378,76,94,4443,advantage hangingPiece middlegame short,https://lichess.org/vaqz2bx6#37,
000mr,5r1k/5rp1/p7/1b2B2p/1P1P1Pq1/2R1Q3/P3p1P1/2R3K1 w - - 0 41,e3g3 f7f4 e5f4 f8f4,1941,85,62,99,crushing middlegame short,https://lichess.org/8sVpuwso#81,
000o3,8/2p1k3/6p1/1p1P1p2/1P3P2/3K2Pp/7P/8 b - - 1 43,e7d6 d3d4 g6g5 f4g5,946,77,87,182,crushing endgame pawnEndgame short zugzwang,https://lichess.org/BAY91mF3/black#86,
000qP,8/7R/8/5p2/4bk1P/8/2r2K2/6R1 w - - 7 51,f2f1 f4f3 f1e1 c2c1 e1d2 c1g1,2052,79,92,917,crushing endgame exposedKing long skewer,https://lichess.org/r4xUR6fC#101,
000rO,3R4/8/K7/pB2b3/1p6/1P2k3/3p4/8 w - - 4 58,a6a5 e5c7 a5b4 c7d8,1110,82,85,69,crushing endgame fork master short,https://lichess.org/tzeeBEc2#115,
0018S,2kr3r/pp3p2/4p2p/1N1p2p1/3Q4/1P1P4/2q2PPP/5RK1 b - - 1 20,b7b6 d4a1 a7a5 f1c1,2560,114,90,1796,advantage endgame pin short,https://lichess.org/H1ARO2GL/black#40,
001Fg,2R2r1k/pQ4pp/5rp1/3B4/q2n4/7P/P4PP1/5RK1 w - - 3 30,c8c7 d4e2 g1h2 a4f4 h2h1 e2g3 f2g3 f4f1,1390,76,94,1403,advantage middlegame veryLong,https://lichess.org/y0QalMAw#59,
001Hi,6k1/pp1r1pp1/1qp1p2p/4P2P/5Q2/1P4R1/P1Pr1PP1/R5K1 b - - 4 23,b6d4 f4f6 d4f2 f6f2 d2f2 g1f2,2389,115,58,19,advantage endgame long pin,https://lichess.org/tUkE0z1z/black#46,
001KR,6Qk/p1p3pp/4N3/1p6/2q1r1n1/2B5/PP4PP/3R1R1K b - - 0 28,h8g8 f1f8,658,81,100,79,mate mateIn1 middlegame oneMove,https://lichess.org/TaT1Zl7z/black#56,
001Oo,6k1/4p1bp/6p1/1p1pP3/1PpPp3/2P1P3/Q2B1KPP/3q4 b - - 2 23,d1a4 a2a4 b5a4 b4b5 g8f7 b5b6,2069,81,84,52,crushing endgame long quietMove,https://lichess.org/8IKs77O9/black#46,
001Wz,4r1k1/5ppp/r1p5/p1n1RP2/8/2P2N1P/2P3P1/3R2K1 b - - 0 21,e8e5 d1d8 e5e8 d8e8,1120,82,89,80,backRankMate endgame mate mateIn2 short,https://lichess.org/84RH3LaP/black#42,
001XA,1qr2rk1/pb2bppp/8/8/2p1N3/P1Bn2P1/2Q2PBP/1R3RK1 b - - 3 23,b8c7 b1b7 c7b7 e4f6 e7f6 g2b7,1648,74,91,1332,crushing discoveredAttack long master middlegame sacrifice,https://lichess.org/KZRiN695/black#46,
001aK,6k1/5p2/4p3/P1B5/2P4P/4Pnp1/Rb1rN3/5K2 b - - 1 33,d2e2 f1e2 g3g2 e3e4 f3d4 e2f2,1989,78,92,248,crushing endgame hangingPiece long quietMove,https://lichess.org/Epr0AiEh/black#66,
001cr,8/3B2pp/p5k1/2p3P1/1p1p1K2/8/1P6/8 b - - 0 38,c5c4 d7e8,1703,81,92,1849,bishopEndgame endgame mate mateIn1 oneMove,https://lichess.org/7FFNwibw/black#76,
001h8,2r3k1/2r4p/4p1p1/1p1q1pP1/p1bP1P1Q/P6R/5B2/2R3K1 b - - 5 34,c4e2 h4h7 c7h7 c1c8 g8g7 c8c7,1780,76,88,618,crushing deflection kingsideAttack long middlegame sacrifice,https://lichess.org/IxCahP6X/black#68,
001m3,7r/6k1/2b1pp2/8/P1N3p1/5nP1/4RP2/Q4K2 w - - 2 38,e2e6 h8h1 f1e2 h1a1,1467,76,87,271,advantage endgame short skewer,https://lichess.org/LELOz22f#75,
001om,5r1k/pp4pp/5p2/1BbQp1r1/6K1/7P/1PP3P1/3R3R w - - 2 26,g4h4 c5f2 g2g3 f2g3,1018,80,89,224,mate mateIn2 middlegame short,https://lichess.org/VWOIWtIh#51,
001u3,2r3k1/p1q2pp1/Q3p2p/b1Np4/2nP1P2/4P1P1/5K1P/2B1N3 b - - 3 33,c7b6 a6c8 g8h7 c8b7,2175,81,55,80,advantage hangingPiece middlegame short,https://lichess.org/BBn6ipaK/black#66,
001uD,6k1/1p3pp1/1p5p/2r1p3/2n5/r3PN2/2RnNPPP/2R3K1 b - - 1 32,f7f6 f3d2 c4d2 c2d2 c5c1 e2c1,1894,75,93,935,advantage long middlegame,https://lichess.org/2qkVLUl6/black#64,
001w5,1rb2rk1/q5P1/4p2p/3p3p/3P1P2/2P5/2QK3P/3R2R1 b - - 0 29,f8f7 c2h7 g8h7 g7g8q,1039,80,85,211,advancedPawn attraction mate mateIn2 middlegame promotion short,https://lichess.org/0e1vxAEn/black#58,
001wR,6nr/pp3p1p/k1p5/8/1QN5/2P1P3/4KPqP/8 b - - 5 26,b7b5 b4a5 a6b7 c4d6 b7b8 a5d8,1172,76,93,2584,endgame long mate mateIn3,https://lichess.org/ruvbd9JW/black#52,
001xl,8/4R1k1/p5pp/3B4/5q2/8/5P1P/6K1 b - - 5 40,g7f6 e7f7 f6e5 f7f4,1149,84,94,11535,advantage endgame master masterVsMaster short skewer superGM,https://lichess.org/bEQkfPQD/black#80,
002CP,r5k1/pp4pp/4p1q1/4p3/3n4/P5P1/1PP2Q1P/2KR1R2 w - - 4 24,f2e3 g6c2,926,83,69,88,endgame mate mateIn1 oneMove queensideAttack,https://lichess.org/pHZnIFdb#47,
002Ds,8/1pp5/p2p4/P2Pk2p/1PP1p2P/2n1K2P/3N4/8 b - - 0 45,b7b6 b4b5 c3d1 e3e2 a6b5 a5a6,1987,75,90,109,crushing endgame knightEndgame long,https://lichess.org/2SrvOtZN/black#90,
002GQ,5rk1/5ppp/4p3/4N3/8/1Pn5/5PPP/5RK1 w - - 0 28,f1c1 c3e2 g1f1 e2c1,654,81,73,134,crushing endgame fork short,https://lichess.org/2K7g2pDT#55,
002Hv,8/8/8/3N2p1/5b2/3p3P/5kP1/3K4 w - - 16 56,d5f4 g5f4 h3h4 f2g2 h4h5 f4f3 d1d2 f3f2,1603,87,63,25,advancedPawn crushing endgame veryLong,https://lichess.org/rLJ8Hp1v#111,
002LF,7r/p2q1pk1/1pp3p1/8/6P1/4Q3/PP1R1P1r/5KN1 b - - 0 38,d7g4 e3e5 f7f6 e5c7 g7h6 c7h2,2158,85,89,482,advantage endgame interference long,https://lichess.org/md88dHiL/black#76,
002LW,3r1rk1/1b1n1pp1/3p4/p4PPQ/4P3/3q1BN1/8/2R2RK1 b - - 1 28,d7e5 f5f6 e5f3 f1f3,2464,88,78,115,advantage middlegame short,https://lichess.org/0khwj5dv/black#56,
002Q2,7k/p4R1p/3p3r/2pN1n2/2PbBBb1/3P2P1/P3r3/5R1K w - - 1 28,f4h6 f5g3,881,78,100,133,mate mateIn1 middlegame oneMove,https://lichess.org/yqAJ1jMv#55,
002Uy,8/8/1p6/k7/P1R5/1K5r/8/8 w - - 26 64,c4c3 h3c3 b3c3 a5a4 c3b2 a4b4,1572,75,97,3963,crushing defensiveMove endgame long rookEndgame,https://lichess.org/sLU7YN1A#127,
002VP,8/6p1/2B1bn2/6k1/3B4/6K1/4P3/8 b - - 4 44,e6d5 d4f6 g5f5 c6d5,1420,79,38,132,crushing endgame short,https://lichess.org/7yJGEbUK/black#88,
002Z9,4r1k1/1p2R1p1/p2p2Pp/P1pP4/5q2/1R3p2/1P1Q3P/5B1K b - - 0 34,f4d2 e7e8,1237,99,69,50,endgame hangingPiece master mate mateIn1 oneMove,https://lichess.org/Ek4aENjD/black#68,
002bK,8/7p/2b1k3/p2p1pPB/1n1P3P/N1p1P3/4K3/8 b - - 1 42,c6b5 a3b5 c3c2 e2d2,1129,76,93,803,advantage endgame hangingPiece short,https://lichess.org/IFGj8W5s/black#84,
002e5,r2q4/pp1n1kbp/3P2b1/6N1/6Q1/P3P3/6P1/4K2R b K - 1 21,f7g8 g4c4 g8h8 h1h7 g6h7 g5f7,2583,82,92,321,crushing long middlegame sacrifice,https://lichess.org/qaapuG48/black#42,
002e8,r3nrk1/1b3pp1/4pb2/p3q3/1p1N4/3B2R1/PPPQN2P/1K4R1 b - - 1 23,a8d8 d2h6 g7g6 g3h3,2465,85,100,71,crushing defensiveMove master middlegame pin short,https://lichess.org/ygzu5djr/black#46,
002rd,r6k/q1pb1p1p/1b3Pr1/p1ppP2Q/3P2p1/4B3/PP2NRPP/3R2K1 b - - 1 25,d7e6 e2f4 c5d4 f4g6 f7g6 h5h6,1795,74,79,124,crushing kingsideAttack long middlegame pin,https://lichess.org/NcD6lul8/black#50,
002uV,r2r2k1/1p2qppp/2n1p3/5n2/p2P4/P2Q1N2/BP3PPP/2R1R1K1 w - - 4 20,d3f5 e6f5 e1e7 c6e7,1631,76,87,73,advantage middlegame short,https://lichess.org/WKH5eIti#39,
002vV,8/6k1/2R4p/5p1P/5P1K/6P1/8/r7 w - - 2 58,c6b6 a1h1,435,92,100,446,endgame master mate mateIn1 oneMove rookEndgame,https://lichess.org/KB7FAntf#115,
002xh,2nk4/8/2PBp1n1/1pK1P1p1/1P4P1/8/8/8 b - - 2 42,g6h4 c5b5 h4g2 b5a6 g2e3 a6b7,2099,98,54,32,crushing endgame long,https://lichess.org/TfRvsd3p/black#84,
0030b,6k1/5ppp/5nb1/pp6/6rP/5N1Q/Pq2r1P1/3R2RK b - - 4 32,g6e4 d1d8 f6e8 d8e8,771,77,100,126,backRankMate mate mateIn2 middlegame short,https://lichess.org/mhIZR6Mc/black#64,
00347,8/2p5/8/2pPk2p/8/4K2P/6P1/8 w - - 1 42,e3d3 h5h4 d3c4 e5d6,2264,75,87,121,crushing endgame pawnEndgame quietMove short,https://lichess.org/xFM0YP9S#83,
0039T,1r5r/p3kp2/4p2p/4P3/3R1Pp1/6P1/P1P4P/4K2R w K - 1 25,d4a4 b8b1 e1f2 b1h1 a4a7 e7f8,1067,90,93,802,crushing defensiveMove endgame long rookEndgame skewer,https://lichess.org/BrtVeJlj#49,
003IX,8/3pk3/R7/1R2Pp1p/2PPnKr1/8/8/8 w - - 4 43,f4f5 e4g3,1718,79,88,1846,endgame mate mateIn1 oneMove,https://lichess.org/576Btq56#85,
003Jb,6k1/3bqr1p/2rpp1pR/p7/Pp1QP3/1B3P2/1PP3P1/2KR4 w - - 6 22,d4a7 e7g5 c1b1 g5h6,993,81,90,391,advantage fork master middlegame short,https://lichess.org/8RvK0idj#43,
003Tx,2r5/pR5p/5p1k/4p3/4r3/B4nPP/PP3P2/1K2R3 w - - 0 27,e1e4 f3d2 b1a1 c8c1,1532,88,82,729,backRankMate endgame fork mate mateIn2 short,https://lichess.org/A7j9VEC0#53,
003UW,8/6pk/7p/2p5/2qp4/5PP1/P3QK1P/8 b - - 1 40,c4d5 e2e4 d5e4 f3e4,1521,75,94,909,advantage endgame queenEndgame short,https://lichess.org/cXMga3rb/black#80,
003aS,8/8/5k1p/6p1/1R4PP/1p2KP2/8/1r6 w - - 0 43,h4h5 b3b2 b4b6 f6e5 f3f4 g5f4,1959,76,92,175,advancedPawn crushing defensiveMove endgame long rookEndgame,https://lichess.org/I7ZktFeR#85,
003eP,8/r1b1q2k/2p3p1/2Pp4/1P2p1n1/2B1P3/NQ6/2K4R b - - 1 36,h7g8 h1h8 g8f7 h8h7 f7e8 h7e7,1156,79,88,1755,crushing exposedKing long middlegame skewer,https://lichess.org/n9vCFmKh/black#72,
003if,8/3q1kpp/1P2p3/4Q3/5P2/4B2P/2r3PK/8 b - - 0 43,d7b7 e5h5 f7e7 e3c5 c2c5 h5c5,1632,107,53,21,advantage endgame long,https://lichess.org/mYGtlm6w/black#86,
003jH,rn3rk1/p5pp/3N4/4np1q/5Q2/1P3K2/PB1P2P1/2R4R w - - 0 25,f3f2 e5d3 f2e3 d3f4 h1h5 f4h5,1067,78,89,315,crushing fork long middlegame,https://lichess.org/3CQGofXT#49,
003jv,1R6/1p2k2p/p2n2p1/4K3/8/6P1/P6P/8 w - - 10 37,b8h8 d6f7 e5e4 f7h8,1007,84,89,339,crushing endgame fork short,https://lichess.org/n0UvwK36#73,
003mh,r4k1r/1pp2p2/p2p3p/3N4/3P2q1/8/PPP5/1K2Q1NR b - - 1 23,a8e8 e1e8 f8e8 d5f6 e8e7 f6g4,1419,78,93,163,advantage attraction fork long middlegame sacrifice,https://lichess.org/HSa4keKZ/black#46,
003nQ,6rk/pp6/2n5/3ppn1p/3p4/2P2P1q/PP3QNB/R4R1K w - - 2 29,f1g1 f5g3 f2g3 g8g3,1287,87,67,31,crushing kingsideAttack master middlegame pin short,https://lichess.org/p85fiZcl#57,
003wQ,2r2rk1/6pp/3Q1q2/8/3N1B2/6P1/PP1K3P/R4b2 w - - 0 24,a1f1 f6d6 f4d6 f8f1,1983,76,92,1981,advantage discoveredAttack middlegame pin short,https://lichess.org/W3wvnzlo#47,
0042j,3r2k1/4nppp/pq1p1b2/1p2P3/2r2P2/2P1NR2/PP1Q2BP/3R2K1 b - - 0 24,d6e5 d2d8 b6d8 d1d8,428,103,94,1364,backRankMate mate mateIn2 middlegame short,https://lichess.org/DuM2FZjg/black#48,
00465,3r1Q1k/pp4pp/2p5/6q1/5R2/2P5/P1P2PPP/3rR1K1 b - - 8 27,d8f8 f4f8,573,92,100,250,backRankMate endgame mate mateIn1 oneMove queenRookEndgame,https://lichess.org/h21VtqGG/black#54,
0047P,8/1N3k2/6p1/8/2P3P1/pr6/R5K1/8 w - - 1 56,g2f1 b3b1 f1e2 b1b2 e2d1 b2a2,1769,75,86,91,crushing endgame exposedKing fork long master,https://lichess.org/Gb33KZKC#111,
0048h,4r3/p5k1/2p2R1p/2Pp4/1P1pr1P1/P6P/8/3R3K w - - 1 35,f6c6 e4e1 d1e1 e8e1 h1g2 d4d3,1166,76,97,1789,crushing endgame exposedKing long rookEndgame,https://lichess.org/dq15P00L#69,
004Ao,4qk2/1b3rR1/p7/1p2Q3/4P2P/P2P3K/2r5/3R4 w - - 5 41,g7f7 e8f7 e5h8 f8e7,1711,96,86,22,advantage endgame short,https://lichess.org/aFlzjb1K#81,
004Ax,8/8/4R1kp/p7/5rPK/8/7P/8 b - - 2 42,g6f7 e6h6 f4f6 h6h7 f7g6 h7a7,1928,77,92,572,crushing endgame exposedKing long rookEndgame,https://lichess.org/x2mMwVJD/black#84,
004JD,3r4/R7/2p5/p1P2p2/1p4k1/nP6/P2KNP2/8 w - - 3 41,d2e3 a3c2,1238,80,91,2758,endgame mate mateIn1 oneMove,https://lichess.org/6vTeEc3x#81,
004LZ,8/7R/5p2/p7/7P/2p5/3k2r1/1K2N3 w - - 3 48,e1g2 c3c2 b1a2 c2c1q h7d7 d2e2,1201,77,93,2033,advancedPawn crushing defensiveMove deflection endgame long promotion,https://lichess.org/drahwNdj#95,
004Lu,8/p1p4p/4Pk2/2PP1p1P/1r3r2/5B2/P3RK2/8 b - - 3 38,f6e7 d5d6 c7d6 c5d6 e7d6 e6e7,1157,75,99,626,advancedPawn advantage endgame exposedKing long master,https://lichess.org/WMeZuWza/black#76,
004Op,2kr2r1/1bp4n/1pq1p2p/p1P5/1P3B2/P6P/5RP1/RB2Q1K1 w - - 3 26,e1f1 d8d1 f1d1 g8g2 g1f1 g2g1 f1e2 g1d1,2189,76,92,1822,crushing deflection kingsideAttack middlegame pin sacrifice skewer veryLong,https://lichess.org/tneg9Bzk#51,
004RF,5rk1/5ppp/1p6/1qp2P1Q/3p3P/6R1/6PK/8 b - - 0 30,c5c4 g3g7 g8g7 f5f6 g7f6 h5b5,1746,78,82,52,attraction crushing discoveredAttack endgame long sacrifice,https://lichess.org/2UeWcE4h/black#60,
004WZ,r6k/1b3pp1/p1q1pn1p/2p5/P1B5/1PN4Q/2P1RP1P/R4Kr1 w - - 2 26,f1g1 c6h1,891,81,93,107,mate mateIn1 middlegame oneMove,https://lichess.org/BQIdXPOM#51,
004X6,1r4k1/p4ppp/2Q5/3pq3/8/P6P/2PR1PP1/Rr4K1 w - - 1 26,a1b1 b8b1 d2d1 b1d1,1152,266,83,14,endgame mate mateIn2 short,https://lichess.org/wvPFkjF9#51,
004XI,8/3kqp2/4p3/p2p4/3P1P2/4P1rP/7r/1QR2K2 b - - 1 34,e7a3 b1b7 d7e8 c1c8,982,90,70,35,endgame mate mateIn2 short,https://lichess.org/54fnArpo/black#68,
004b0,5kB1/4b3/4P3/2p2P2/2b5/8/p7/B6K w - - 4 48,g8f7 e7g5 f5f6 g5e3 a1e5 e3f4 e5f4 a2a1q,2368,109,47,33,advancedPawn bishopEndgame crushing deflection endgame promotion quietMove veryLong,https://lichess.org/CJKIi1QJ#95,
004d8,8/4kr2/R2p4/1p1Pp1p1/5p2/3K1P2/PPP5/8 b - - 0 39,g5g4 a6a7 e7f6 a7f7 f6f7 f3g4,1608,78,87,103,crushing endgame long rookEndgame,https://lichess.org/FrR3BHbW/black#78,
004iZ,r2r2k1/2q1bpp1/3p1n1p/1ppN4/1P1BP3/P5Q1/4RPPP/R5K1 b - - 1 20,f6d5 g3g7,400,112,89,979,kingsideAttack mate mateIn1 middlegame oneMove,https://lichess.org/dQ85JUe1/black#40,
004mT,5Q2/8/1b1kp1p1/5p2/3p4/5qPK/7P/8 b - - 1 51,d6c6 f8a8 c6d6 a8f3,1338,76,98,7212,advantage endgame short skewer,https://lichess.org/Jqhi4ozb/black#102,
004nd,3q2k1/2r5/pp3p1Q/2b1n3/P3N3/2P5/1P4PP/R6K b - - 0 24,c7d7 e4f6 d8f6 h6f6,898,75,83,207,crushing fork middlegame short,https://lichess.org/IajkZZBp/black#48,
004sY,8/2k3n1/3p2p1/1KpP2Pp/2P4P/7B/8/8 w - - 0 57,b5a6 c7d8 a6b5 g7f5,2191,95,68,32,crushing endgame short,https://lichess.org/sMrTPfXp#113,
004sg,6k1/p3b2p/1p1pP3/2p3P1/1Pnp3B/P6P/3Q3K/8 w - - 0 38,b4c5 c4d2 c5c6 d6d5 g5g6 e7d6,2444,85,91,1255,advantage clearance endgame hangingPiece long quietMove,https://lichess.org/pSRIvt7K#75,
004u0,6k1/ppq3pp/2p1rp2/4r3/4p1Q1/P5RP/1P3PP1/3R2K1 b - - 3 34,e6e8 d1d7 c7d7 g4d7,1388,75,93,1010,advantage endgame short,https://lichess.org/3gEqoQeQ/black#68,
004zI,2q3k1/4br1p/6RQ/1p1n2p1/7P/1P4P1/1B2PP2/6K1 b - - 0 27,h7g6 h6h8,1461,78,88,331,endgame mate mateIn1 oneMove,https://lichess.org/HE33gdt4/black#54,
004zh,4b1k1/4Pr2/3R2pp/1ppBP1q1/8/PP4P1/2P4P/3R3K b - - 2 38,g5h5 d1f1 g8g7 d5f7 e8f7 d6d8 h5e5 f1f7 g7f7 e7e8q e5e8 d8e8,2622,93,68,113,advancedPawn attraction crushing endgame exposedKing intermezzo pin promotion quietMove veryLong,https://lichess.org/sYeKSrqj/black#76,
0050w,5rk1/1p2p1rp/p2p4/2pPb2R/2P1P3/1P1BKP1R/8/8 b - - 4 30,g7g3 h3g3 e5g3 h5g5 g8f7 g5g3,1068,80,90,1500,crushing endgame fork long,https://lichess.org/QD8pUcTR/black#60,
0055Y,r1b2rk1/p3pp2/2B4b/2Qpq3/3N2pp/4P3/2P2PPP/1R2K2R b K - 1 23,h6e3 f2e3 e5e3 e1d1,2041,76,80,148,advantage defensiveMove middlegame short,https://lichess.org/7Jpwzowt/black#46,
005Bm,4rk2/p1q5/1p3Q1b/8/1p5N/2P1p3/P3P3/2K5 b - - 0 43,c7f7 h4g6 f8g8 f6h8,1322,75,98,2862,endgame mate mateIn2 pin short,https://lichess.org/KKslCMev/black#86,
005Ep,5kr1/ppR3p1/3R3p/8/1r1n4/8/1P3PPP/2K5 b - - 4 31,d4b5 d6d8,850,77,100,108,endgame mate mateIn1 oneMove,https://lichess.org/ttFEoJfQ/black#62,
005N7,r6k/2q3pp/8/2p1n3/R1Qp4/7P/2PB1PP1/6K1 b - - 0 32,e5c4 a4a8 c7b8 a8b8,640,103,95,1881,backRankMate endgame hangingPiece mate mateIn2 short,https://lichess.org/jxZhmGhg/black#64,
005YM,5k2/p4pp1/1qn3r1/3pP2p/5P2/1NPQ4/Pr3RPP/R5K1 w - - 5 24,b3d4 b2f2 g1f2 c6d4 d3d4 b6b2,2437,96,89,233,advantage long middlegame,https://lichess.org/fDmK2ipV#47,
005YX,2rr4/2N2pk1/p1Q1b1pp/1p4q1/3pP3/1B1P4/PPP3PP/6RK w - - 7 25,c7e6 f7e6 c6b7 g7h8,1820,162,100,28,defensiveMove equality middlegame short,https://lichess.org/zbi5w5Qy#49,
005do,7r/pp1k4/4p1b1/3pP1Np/3P1P1K/8/P7/2R5 b - - 7 42,h8f8 c1c7 d7c7 g5e6 c7b6 e6f8,1444,245,100,23,attraction crushing deflection endgame fork long sacrifice,https://lichess.org/Q1hPi58C/black#84,
005f3,r5k1/2p1pp2/pp4p1/1q1r4/5P2/2QP2R1/PP6/1K4R1 b - - 0 32,d5h5 g3g6 f7g6 g1g6 g8f7 c3g7 f7e8 g7g8 e8d7 g8e6 d7d8 g6g8,1995,73,95,13970,crushing endgame sacrifice veryLong,https://lichess.org/Prb24UzR/black#64,
005jR,8/5p1k/1P4pp/3Qn3/4BP2/6P1/1p2P2P/2q3K1 w - - 1 34,g1f2 b2b1q e4b1 e5g4 f2f3 c1h1,2696,95,93,129,advancedPawn crushing endgame long promotion,https://lichess.org/ltr8kYV9#67,
005nD,3rk2r/2qn1pp1/p1Q1R3/3n3p/8/8/PP4PP/5R1K b k - 0 23,f7e6 c6e6 d5e7 e6f7,1066,76,99,1036,fork mate mateIn2 middlegame short,https://lichess.org/hlgaj6lV/black#46,
005qG,8/8/1p1k1p1p/3npp2/2B5/PP1K1PP1/7P/8 b - - 0 36,f5f4 c4d5 f4g3 h2g3 d6d5 g3g4,2310,85,65,55,crushing defensiveMove endgame long,https://lichess.org/RMj9gStA/black#72,
005ws,8/8/5pp1/3K3p/3N2kP/8/8/8 w - - 2 62,d5e6 g6g5 h4g5 f6g5 e6d5 h5h4 d5e4 h4h3 d4f3 g4g3,2339,77,93,1819,crushing endgame knightEndgame master masterVsMaster quietMove veryLong,https://lichess.org/LOwACSXb#123,
005wy,1r6/pp2kpp1/2n1p1n1/3p2PQ/5P2/2PqP3/PP1N4/2KR3R w - - 3 27,h5h7 c6b4 c3b4 b8c8 d2c4 c8c4,1881,74,95,5219,long mate mateIn3 middlegame queensideAttack sacrifice,https://lichess.org/mBQMheB4#53,
005xu,8/3k4/1K1P4/2P3r1/R7/5b2/8/8 b - - 0 68,g5g8 a4a7 d7e6 a7e7 e6d5 d6d7,1914,86,84,35,advancedPawn crushing endgame exposedKing long,https://lichess.org/TDu28XvE/black#136,
005yO,r1r3k1/ppq3bQ/4p2p/4n3/3p4/2P5/PBB2PPP/4R1K1 b - - 2 24,g8f8 b2a3 f8f7 c2d1 c8h8 d1h5 f7f6 h7e4,2973,106,90,492,advantage exposedKing middlegame quietMove veryLong,https://lichess.org/j65YI8hC/black#48,
0061g,6k1/pp3pp1/2p1q1Pp/3b4/8/6Q1/PB3Pp1/3RrNK1 b - - 2 27,e1d1 g3b8 e6e8 b8e8,801,93,73,268,endgame mate mateIn2 short,https://lichess.org/dJ3xEKJK/black#54,
0068D,7r/pppk4/2pb1r2/8/2NP2p1/2P5/PP2RPP1/4R1K1 w - - 2 26,c4d6 f6h6 f2f4 g4g3 e2e7 d7d6 g1f1 h6h1,1867,75,92,702,crushing endgame veryLong,https://lichess.org/WNAZgV2o#51,
006E1,5rk1/R4pp1/1p5p/3Q4/1PPp2q1/3P2P1/5P2/4nK2 w - - 0 34,f1e1 f8e8 e1f1 g4h3 d5g2 e8e1 f1e1 h3g2,1567,73,96,17762,crushing deflection endgame veryLong,https://lichess.org/KaLKLKD5#67,
006HV,1r6/5k2/2p1pNp1/p5Pp/1pQ1P2P/2P4R/KP3P2/3q4 w - - 4 31,c4c6 b4b3 a2a3 d1a1,1145,78,93,997,endgame mate mateIn2 short,https://lichess.org/ibb2c72C#61,
006NL,1r6/k2qn1b1/p1b1p1p1/2PpPpN1/2nN1P1P/p4B2/1PP2Q2/1K1R3R w - - 0 32,d4c6 e7c6 b2b3 a3a2 b1a1 c4e5 f4e5 g7e5 a1a2 b8b5,2545,89,86,91,advancedPawn advantage middlegame pin veryLong,https://lichess.org/yA3M5Q6W#63,
006OI,8/p7/5k2/P5R1/6KP/8/8/5r2 w - - 5 53,g5g8 f1g1 g4f4 g1g8,843,97,76,261,crushing endgame rookEndgame short skewer,https://lichess.org/6AH1H5wg#105,
006RM,1k1r3r/2q5/pp1n2p1/8/1Q6/3R2P1/PPP2P1P/3R2K1 b - - 4 29,c7c5 b4c5 b6c5 d3d6 d8d6 d1d6,1455,77,82,1123,crushing long middlegame,https://lichess.org/ceS0QvtT/black#58,
006cZ,3r1rk1/1p4p1/p1p3Qp/2q5/8/3n1N1P/PP1R2P1/5R1K b - - 7 28,g8h8 d2d3 d8d3 g6d3,1365,75,88,649,advantage master masterVsMaster middlegame short,https://lichess.org/qrbDEp56/black#56,
006ia,1r4k1/4bpp1/1rp2n1p/3p4/3P4/2N1B1P1/Pq2QPKP/2R1R3 w - - 3 24,e3h6 b2e2 e1e2 e7a3 h6e3 a3c1,2073,136,68,9,advantage long middlegame,https://lichess.org/fcKXrUhC#47,
006of,r2qr2k/1pp2pp1/1b4np/pP2P3/P4n2/BQN2N1P/5PP1/R3R1K1 w - - 3 20,b3f7 d8d3 c3e2 f4e2 e1e2 d3e2,2602,113,89,932,advantage kingsideAttack long middlegame,https://lichess.org/MIdWd89x#39,
006om,1r3k2/5p1p/2p1pp2/P2n4/2r1N3/P4PK1/2R2P1P/2R5 b - - 9 29,c4a4 e4c5 a4a5 c5d7 f8g7 d7b8,1816,74,95,7202,crushing endgame fork long master,https://lichess.org/BMIgw1OR/black#58,
006pe,r4r2/2q1NN2/4bQpk/2n4p/pp5P/8/1PP2PP1/2KR3R b - - 0 28,e6f7 e7f5 h6h7 f6g7,1628,75,97,2713,master mate mateIn2 middlegame pin short,https://lichess.org/gkSEAS27/black#56,
006wz,2r5/4ppkp/5bp1/1p6/1P6/P3B3/2r2PPP/1R1R2K1 b - - 2 22,f6b2 b1b2 c2b2 e3d4 f7f6 d4b2,1434,75,80,536,attraction crushing endgame fork long sacrifice,https://lichess.org/qT0W6o27/black#44,
006yP,6R1/8/Kpk1p3/1p1pP3/6P1/PPP1r3/8/8 b - - 3 40,e3c3 g8c8 c6d7 c8c3,819,89,80,151,crushing endgame master rookEndgame short skewer,https://lichess.org/vf9MOLH1/black#80,
0071K,3N1r2/6R1/kp6/p2pPp1Q/2pP2P1/2q5/2P5/2K5 w - - 0 38,g7a7 a6a7 h5h7 a7a6,1130,84,93,419,crushing defensiveMove endgame hangingPiece short,https://lichess.org/gY0ZkxR4#75,
0071N,6k1/p4pp1/1p5p/4b3/4B3/4P1P1/PpR2PKP/3r4 b - - 1 30,b2b1q c2c8 d1d8 c8d8,483,88,100,180,endgame mate mateIn2 short,https://lichess.org/HRlw71ON/black#60,
00734,rn3bk1/2rqp2p/2p3p1/3p1p2/3P1P1B/pP1BP3/P1Q2PRP/1KR5 b - - 0 26,b8a6 d3f5 e7e6 f5g6,1661,74,89,125,crushing middlegame pin short,https://lichess.org/jM0Jnw0u/black#52,
00761,3r2k1/1b3pbR/p2P2P1/3p2N1/2p5/2P2N2/PP6/2K5 b - - 0 28,f7g6 h7g7 g8g7 g5e6 g7g8 e6d8,1474,79,94,21734,attraction crushing endgame exposedKing fork long sacrifice,https://lichess.org/vu70Maig/black#56,
0078T,rk5r/1b3R2/pp2p2q/4P2p/B2p3B/4R2P/PP4P1/5Q1K b - - 0 27,d4e3 f7b7 b8b7 f1f7 b7b8 h4e7,2248,80,81,86,attraction crushing defensiveMove exposedKing long middlegame queensideAttack sacrifice,https://lichess.org/mXf4gFYU/black#54,
007Rn,4r1k1/p4p1p/1p6/6q1/3P2n1/P4Q2/1P1B2P1/7K w - - 0 34,d2g5 e8e1 f3f1 e1f1,992,82,75,76,endgame mate mateIn2 short,https://lichess.org/L9kH7FqT#67,
007eS,6k1/p4p2/1p5p/4r3/P3B3/1P3P2/2PK2PP/8 w - - 0 29,d2e3 f7f5 g2g4 f5e4,1297,76,96,11436,advantage endgame short,https://lichess.org/8qs8bafy#57,
007en,rn3rk1/4pp1p/3p2pB/2q4P/3bP1b1/Pp2Q3/1P2B3/1K1R2NR w - - 0 20,e3d4 c5c2 b1a1 a8a3 b2a3 c2a2,1876,75,97,1950,long mate mateIn3 middlegame queensideAttack sacrifice,https://lichess.org/jzE2yKAk#39,
007fJ,8/1P3ppp/8/8/8/2pk3P/3p2P1/3K4 w - - 0 52,b7b8q c3c2,542,101,88,512,advancedPawn endgame mate mateIn1 oneMove queenEndgame,https://lichess.org/34ezZi7R#103,
007gO,2r3rk/5p2/4p2p/4q3/1Q6/8/1P3PPP/R4RK1 w - - 0 31,a1c1 e5g5 g2g3 c8c1,2177,86,76,47,crushing endgame short,https://lichess.org/id1brvZc#61,
007ku,r1bq3Q/1np2kp1/p5B1/1p1Pp3/1Pn2BP1/2b2P2/P3K3/R4N2 b - - 5 35,f7g6 h8h5 g6f6 f4g5,1627,75,89,963,mate mateIn2 middlegame short,https://lichess.org/QveLbBjG/black#70,
0082f,r4rk1/2q2ppp/3pp3/4Pb1N/pp6/1B4Q1/PPP3PP/1K1RR3 b - - 0 21,a4b3 g3g7,932,80,100,303,kingsideAttack mate mateIn1 middlegame oneMove,https://lichess.org/fHfmODEz/black#42,
0088O,7Q/2p5/1p2prp1/p4k1p/P4p1P/8/6RK/3q4 b - - 2 37,d1a4 g2g5 f5e4 h8f6,1133,80,85,443,crushing deflection endgame short,https://lichess.org/GmH1DPx6/black#74,
008EC,6k1/4rpp1/p6p/7P/q1pP1R2/2Pb2Q1/P4RP1/6K1 w - - 9 31,f4f7 e7f7 g3b8 g8h7 f2f7 a4d1 g1f2 d1f1 f2g3 f1f7,2244,80,90,388,advantage endgame skewer veryLong,https://lichess.org/q5CqLXP5#61,
008GK,1k1r4/ppp3p1/8/1P5p/8/P3n2P/2P1r1P1/B3NRK1 b - - 4 31,d8d1 f1f8 d1d8 f8d8,536,109,90,1708,backRankMate endgame mate mateIn2 short,https://lichess.org/9vFFDYsH/black#62,
008LD,8/6pp/4N1k1/5p2/5P2/5rPb/4R2P/6K1 w - - 0 35,e6g5 f3f1,404,101,78,177,endgame mate mateIn1 oneMove,https://lichess.org/jzHHsjDp#69,
008LT,r4rk1/6p1/b3p1nN/p1pp4/1p3P1q/3P1Q1B/PPP2PK1/R6R b - - 0 26,g8h8 h6f7 f8f7 h3e6,2092,85,90,1308,crushing kingsideAttack middlegame pin sacrifice short,https://lichess.org/vnxisKeU/black#52,
008Nz,6k1/2p2ppp/pnp5/B7/2P3PP/1P1bPPR1/r6r/3R2K1 b - - 1 29,d3e2 d1d8,455,100,84,889,backRankMate mate mateIn1 middlegame oneMove,https://lichess.org/HNU4zavC/black#58,
008P4,8/4k3/1p1p4/rP2p1p1/P2nP1P1/3BK3/8/R7 w - - 0 35,e3d2 d4b3 d2c3 b3a1,788,99,95,1598,crushing endgame fork short,https://lichess.org/3GoHPRp3#69,
008Sk,8/6pp/3Bp2k/p2pP2P/P2bp1PK/8/r7/5R2 b - - 2 37,d4f2 f1f2 g7g5 h4g3 a2f2 g3f2,2140,81,94,12428,crushing endgame long,https://lichess.org/rah6MiKa/black#74,
008Y3,r5k1/1p1rqpp1/p3pnp1/2PN4/8/1Q5P/PP3PP1/3RR1K1 b - - 0 24,e7c5 d5f6 g7f6 d1d7,1082,86,93,652,advantage discoveredAttack kingsideAttack master middlegame short,https://lichess.org/jAILX5BH/black#48,
008lc,7k/pb1qn2n/1p2R2Q/2p2p2/2Pp4/3B4/PP3PrP/4RK2 b - - 1 27,g2g7 h6g7 h8g7 e6e7 d7e7 e1e7,2074,80,92,2119,attraction crushing exposedKing fork long middlegame,https://lichess.org/UdZXrVA5/black#54,
008nF,2rq1rk1/7p/1n4pb/1R2p3/pPpP1P2/P1B5/3NQ1PP/2R3K1 w - - 0 31,e2e5 f8e8 e5e8 d8e8,2133,79,90,799,crushing master middlegame short trappedPiece,https://lichess.org/tYO5rrIU#61,
008o6,Q5k1/p1p3p1/5rP1/8/3P4/7P/q3r3/B4RK1 b - - 1 34,f6f8 a8f8,471,88,75,124,endgame mate mateIn1 oneMove,https://lichess.org/1k4lXfEi/black#68,
008oX,4r1k1/2R3pp/2p4q/1p1p4/3P4/P7/1PP2R2/1K1N4 b - - 3 32,e8e1 c7c8 e1e8 c8e8,978,76,71,219,endgame mate mateIn2 short,https://lichess.org/APGKH8YH/black#64,
008tL,8/7k/pR5p/3p4/5r2/2P1p2P/P5P1/6K1 w - - 0 40,b6a6 e3e2 a6e6 f4f1,1104,84,95,3074,advancedPawn crushing endgame master rookEndgame short,https://lichess.org/yhNupFCi#79,
0091A,1r3rk1/q4ppp/p3Pb2/3nN3/P2P4/7Q/1B4PP/1R3RK1 b - - 0 24,b8b2 e6f7 f8f7 h3c8 f7f8 c8e6,2239,78,95,815,advancedPawn advantage kingsideAttack long middlegame,https://lichess.org/XYVC46Km/black#48,
0092z,2r3k1/2qR1ppp/p7/2p2Q2/P7/7P/5PP1/6K1 b - - 3 26,c7c6 f5f7 g8h8 f7g7,938,91,94,425,endgame mate mateIn2 short,https://lichess.org/fjaha7q0/black#52,
0095W,8/pp1r2kp/q2P1ppb/4p3/2N1P3/1Q5P/PPR2PP1/6K1 w - - 3 32,c4e5 f6e5 c2c7 a6d6,1850,76,93,2210,advantage endgame hangingPiece short,https://lichess.org/CaL8Bl7F#63,
009BH,3r2k1/6p1/4Q3/4B3/1p3P2/4PKP1/3q4/8 b - - 17 51,g8h8 e6h6 h8g8 h6g7,1566,75,98,5090,endgame mate mateIn2 pin short,https://lichess.org/QauOOpOY/black#102,
009IO,3rk3/5p1r/p2Np1p1/3bP3/P2n4/8/1P3RPP/5RK1 b - - 4 25,e8e7 f2f7 h7f7 f1f7,1163,82,87,544,hookMate mate mateIn2 middlegame short,https://lichess.org/LJBrm9Or/black#50,
