PuzzleId,FEN,Moves,Rating,RatingDeviation,Popularity,NbPlays,Themes,GameUrl,OpeningTags
00PGi,3r1q1k/pppb2pp/2np4/6N1/5B2/1Q4P1/PP4PP/4R2K b - - 11 24,b7b6 g5f7 f8f7 b3f7,1029,84,93,1080,crushing fork middlegame short,https://lichess.org/qzZ4hC7X/black#48,
00PHg,R7/P4p2/5k1p/q5n1/5R2/7P/5PK1/8 b - - 2 46,f6e5 a8e8 e5f4 a7a8q a5a8 e8a8,1400,75,94,2098,advancedPawn advantage clearance endgame long promotion,https://lichess.org/u5o6sm6r/black#92,
00PIO,2k1r2r/1p2P3/p1b1p3/3p1npp/5q2/1N3N1Q/PP3PPP/2R2RK1 w - - 1 22,f3d4 f5d4 b3d4 f4d4 h3e6 c8c7,2295,82,87,787,crushing long middlegame,https://lichess.org/QcmS4aBG#43,
00Pbs,3r1rk1/Q3qppp/8/1ppb4/2Pn1B1n/2N3P1/PP3P2/R2R1K2 w - - 0 21,a7e7 d5g2 f1e1 h4f3,2108,76,66,182,mate mateIn2 middlegame short,https://lichess.org/fA2DSaPB#41,
00PgQ,3r4/P1R5/7P/4p3/8/4p3/2p1K3/1k6 w - - 1 55,e2e3 c2c1q c7c1 b1c1 e3e4 d8e8,2121,76,87,164,advancedPawn crushing defensiveMove endgame long master promotion,https://lichess.org/6ByRjehu#109,
00PrK,r7/7R/P3k3/4p2p/3b2p1/3K4/8/5R2 b - - 7 55,a8a6 h7h6 e6d5 h6a6,969,81,91,183,crushing endgame short skewer,https://lichess.org/N9FWAV9a/black#110,
00Pu5,6k1/1b3pbp/6p1/1Nr3q1/1Q1p4/P7/5PPP/4RBK1 b - - 0 27,c5c1 e1e8 g7f8 b4f8,1394,221,0,13,master mate mateIn2 middlegame short,https://lichess.org/x04vixVv/black#54,
00PvP,8/6B1/7p/1p4p1/1Pp3P1/5P1k/4K2b/8 b - - 18 51,h6h5 g4h5 h3h4 h5h6 h4h5 h6h7,848,124,100,21,advancedPawn bishopEndgame crushing endgame long,https://lichess.org/M7zTwdgr/black#102,
00PvX,8/n7/P7/3k4/PK6/7P/5PP1/8 w - - 0 53,b4a5 d5c5 f2f3 a7c6,1660,75,86,241,endgame knightEndgame mate mateIn2 short,https://lichess.org/tH6dRFcZ#105,
00Pw1,5r1k/2p3Rp/3p4/p2Pn3/1p2B3/1P6/PKP2r1P/6R1 b - - 1 28,f2e2 g7h7,1104,75,98,860,endgame master mate mateIn1 oneMove,https://lichess.org/WAkWH6IK/black#56,
00Q4m,5r2/1b3k2/1q4p1/p3Pp1p/2pn1P1P/4Q1P1/P6K/R1R2B2 w - - 2 34,f1g2 d4f3 e3f3 b7f3,1194,75,100,174,advantage middlegame short,https://lichess.org/LOKLTnN2#67,
00Q4v,8/2p1b3/q1Pp2k1/3Pp3/4Pr2/1Q3PK1/3N2P1/7R w - - 1 47,h1e1 e7h4 g3h2 h4e1,1228,81,74,64,crushing endgame short skewer,https://lichess.org/gHKVgDSR#93,
00QCD,3r1rk1/1Q3ppp/1q2pb2/8/1P1N4/4P1P1/3B1PBP/R5K1 b - - 0 23,b6b7 g2b7 f6d4 e3d4,1041,79,94,241,advantage middlegame short,https://lichess.org/AFf6cmqa/black#46,
00QCe,1k5r/n2r2pp/5p2/ppN5/5P2/8/2R3PP/1R4K1 b - - 3 28,d7c7 c5a6 b8b7 a6c7,1398,75,93,1300,crushing endgame fork short,https://lichess.org/fovXj5D1/black#56,
00QHM,6k1/pp3rpp/4Nb2/4p3/1B1r4/6PK/PP5P/2R5 b - - 0 28,d4b4 c1c8 f6d8 c8d8 f7f8 d8f8,911,97,95,220,endgame long mate mateIn3,https://lichess.org/VyUHT6ng/black#56,
00QOa,6rk/1pp1R1p1/6Bp/2b4P/8/pP3PK1/P1P5/8 w - - 5 32,e7c7 c5d6 f3f4 d6c7,862,108,95,526,crushing endgame fork short,https://lichess.org/afclLtrR#63,
00QOp,4r3/pp2rkp1/2p5/P2p2pP/R4bP1/2NQ4/1PP2P2/3Kq2R w - - 3 25,h1e1 e7e1,435,91,100,116,mate mateIn1 middlegame oneMove,https://lichess.org/7puRAwZg#49,
00QQS,2r3k1/1p1q1ppp/4p3/Q7/3P4/P1B5/1Pr2PPP/R5K1 b - - 0 22,d7d4 c3d4 c2c1 a5e1,1828,167,43,18,advantage endgame hangingPiece short,https://lichess.org/tG606j71/black#44,
00QVZ,8/7p/4K3/6p1/2k3P1/8/5P2/8 b - - 0 43,c4d4 e6f5 h7h6 f5g6 d4e4 g6h6,1459,75,81,519,crushing endgame long master pawnEndgame,https://lichess.org/gVqoHhuS/black#86,
00QW1,8/3r1ppp/4p3/k3P3/pR2R2P/2P5/2Kr1PP1/8 w - - 4 31,c2c1 d2d1 c1b2 d7d2 b2a3 d1a1,899,93,95,218,endgame exposedKing long mate mateIn3 rookEndgame,https://lichess.org/I3LnvYRW#61,
00QY3,2k3r1/pp5p/4p3/2p2p2/2P5/P4P1q/1PQ1RR1b/7K w - - 0 32,f2h2 h3f1,1048,76,88,283,endgame master mate mateIn1 oneMove,https://lichess.org/Ip4qQXo1#63,
00QjF,8/8/1pr1p1kp/pbPp2pN/3Pp1P1/1P2K3/P6P/2R5 b - - 0 29,e6e5 c5b6 c6c1 b6b7 c1e1 e3d2,2103,76,86,703,advancedPawn crushing endgame long master sacrifice,https://lichess.org/oPvDBkpv/black#58,
00Qlc,8/5R2/P7/2p1r3/2Pp2k1/3K4/5p2/8 b - - 1 54,e5f5 f7f5 g4f5 d3e2 f2f1q e2f1,1610,75,93,1267,crushing endgame long rookEndgame,https://lichess.org/CvcBVbVr/black#108,
00QnO,1k1r1r2/pp4p1/6q1/2Qp4/5bP1/2P4p/PPN3NP/R4R1K w - - 0 30,g2f4 g6e4 h1g1 f8f4,1452,76,92,3178,crushing fork intermezzo middlegame short,https://lichess.org/9GENZopF#59,
00Qo8,8/8/RP4p1/1r1N1pkp/P1n1p3/6P1/6P1/4K3 b - - 0 49,b5d5 b6b7 d5d8 a6a8,1064,79,94,269,endgame,https://lichess.org/Sxlq7BKB/black#98,
00Qpu,3r1b1r/2pn4/1p1p3p/2kP2qn/Q3Pp2/4Bp2/1P4PP/4R1K1 b - - 3 26,f4e3 e1c1,1156,75,97,669,mate mateIn1 middlegame oneMove,https://lichess.org/GLsIyi7p/black#52,
00QyM,8/3k4/1pp3p1/4Pp1p/2PK1P1P/pP6/P7/8 b - - 1 35,d7e6 b3b4 e6e7 b4b5 c6b5 c4b5,2227,78,94,1075,crushing endgame long pawnEndgame quietMove zugzwang,https://lichess.org/DcRRuwOx/black#70,
00R0m,8/4k2p/Q1p1p3/p2pP1r1/q7/P6P/1P3PK1/2R2R2 w - - 1 28,g2f3 a4e4,1355,98,38,33,endgame mate mateIn1 oneMove,https://lichess.org/qcC85YJl#55,
00R2A,2kr1b1R/p5p1/8/3P1p2/8/4B3/PPPK1P2/8 w - - 1 25,c2c4 f8b4 d2d3 d8h8,843,79,99,1388,crushing discoveredAttack endgame short,https://lichess.org/ZjzT3REI#49,
00R4l,r1b5/p4pkp/3p2p1/2pPr3/2P5/1P1B4/R4PPP/R5K1 w - - 0 24,a2a7 a8a7 a1a7 e5e1 d3f1 c8f5,1541,75,89,1547,advantage defensiveMove endgame long,https://lichess.org/IQW9ts1W#47,
00R8C,r4q1k/2bn2p1/2p3pp/1pP5/1P1B2P1/1Q1P1r1P/5PB1/4RRK1 w - - 0 27,g2f3 f8f4 d4g7 h8h7 e1e5 d7e5 g7e5 c7e5 f1e1 f4f3,2409,98,81,43,crushing fork master middlegame veryLong,https://lichess.org/ZILz4GAu#53,
00R9D,8/1k6/1pn1R3/8/Pp4p1/4P3/5PK1/8 w - - 0 51,e6e4 b4b3 e4g4 b3b2,1220,168,82,8,advancedPawn crushing endgame short,https://lichess.org/3ZXSyu03#101,
00ROK,5k2/p1p2R2/1r2rp2/3p1Q2/2qP2R1/2P4P/6PK/4q3 b - - 0 33,f8f7 f5h7 f7f8 g4g8,1438,75,89,742,endgame mate mateIn2 short,https://lichess.org/EXabGwlP/black#66,
00RPk,8/2p5/5ppp/1PkP4/p4PPP/P1K5/8/8 b - - 0 39,c5b5 c3d4 c7c5 d5c6 b5c6 d4c4,2545,90,93,1131,advantage defensiveMove enPassant endgame long pawnEndgame,https://lichess.org/vOFXdfEu/black#78,
00RWr,6k1/5pp1/n3p2p/1q1pN3/8/4PB1P/Q4PPK/2r5 b - - 3 36,a6c5 a2a8 g8h7 e5f7 b5b2 a8h8 h7g6 h8g8 g6f6 f3h5,2993,121,88,439,crushing defensiveMove deflection endgame veryLong,https://lichess.org/20uXWTrv/black#72,
00RXz,1k1r4/pp1b4/2pq1p1p/6p1/8/1Q4P1/PP3PBP/3R2K1 b - - 0 27,d6e6 b3e6 d7e6 d1d8,1214,76,80,254,advantage endgame queensideAttack short,https://lichess.org/KgK5s7Qu/black#54,
00RYH,1k5r/ppp1R2p/3r1p2/5Q2/3p4/2qP4/2P2PPP/2K1R3 b - - 5 26,d6a6 e7e8 h8e8 e1e8,1029,83,89,119,backRankMate endgame mate mateIn2 short,https://lichess.org/qGI2u50w/black#52,
00RbX,3r2k1/2q1bppp/b3n3/p2N4/2p1P3/P3QN2/1PP2PPP/4R1K1 b - - 1 22,e7c5 d5c7 c5e3 c7e6 e3f2 g1f2,1616,77,79,112,advantage long middlegame,https://lichess.org/vo7nrvYf/black#44,
00Rcs,3k4/ppp2p1r/4p2P/5n2/3Pp1N1/2P2K2/P1P3P1/7R w - - 0 30,f3e4 f5g3 e4f4 g3h1,849,89,95,2246,crushing endgame fork short,https://lichess.org/6z8dEdCK#59,
00Rep,8/8/b1k5/p1N5/2p5/1P4P1/P6P/6K1 w - - 1 51,c5a6 c4c3 b3b4 c3c2,1585,76,94,573,advancedPawn crushing endgame knightEndgame short,https://lichess.org/jXFjUSJk#101,
00Rk3,8/1p2rppk/5q1p/Q4R2/2P5/PP5P/5PP1/5rK1 w - - 0 32,g1f1 f6a1 a5e1 e7e1,816,82,100,209,endgame mate mateIn2 short,https://lichess.org/9ceeRcuK#63,
00Rmm,2rr2k1/5ppp/p7/1p1nP3/1B1P1PP1/PK5P/4R3/3R4 w - - 4 30,e2c2 c8c2 b3c2 d5e3 c2d3 e3d1,1448,75,99,1488,advantage attraction endgame fork long,https://lichess.org/MjgWCyPg#59,
00RtC,r4k2/ppp3p1/3p3r/2q5/2NnP3/2Q2PBp/PP3R1P/5RK1 w - - 4 25,b2b4 d4e2 g1h1 c5f2 c3g7 f8g7,1948,82,86,55,advantage deflection discoveredAttack long middlegame pin,https://lichess.org/cgruxBCC#49,
00Ru6,3r1r2/p5kp/1p4pP/2p5/2PbBQ2/2q5/P1P1K3/5R2 b - - 0 34,g7h8 f4f8 d8f8 f1f8,974,84,80,72,mate mateIn2 middlegame short,https://lichess.org/SA1K2pZD/black#68,
00Rvy,r6k/6bp/p7/2Q5/8/5P2/4bKPP/8 b - - 2 37,e2d3 c5d5 a8f8 d5d3,1296,84,9,54,advantage endgame fork short,https://lichess.org/AFL6C8p8/black#74,
00S6j,3rr1k1/pp1q1pp1/1n1P1b1p/1Np5/8/1Q3N1P/PP3PP1/3R1RK1 b - - 2 20,a7a6 b5c7 d7c6 c7e8,1369,142,73,12,crushing master middlegame short,https://lichess.org/btjYBomF/black#40,
00SCA,8/2Q5/2p2nk1/8/2r2K2/8/8/8 w - - 4 71,f4e5 c4e4 e5d6 f6e8 d6d7 e8c7,1189,79,95,1456,crushing endgame fork long,https://lichess.org/JVchiAe8#141,
00SIq,r3r1k1/1Q3ppp/8/pP6/2q5/7P/3R2P1/5R1K w - - 0 30,f1f7 c4f7 b7f7 g8f7,1903,75,83,245,crushing endgame short,https://lichess.org/WCK83FsZ#59,
00SOy,6k1/6b1/p1r1p2p/1pN4r/3P3q/2P2Q2/P4PP1/1R2R1K1 w - - 2 31,f3c6 h4h1,783,99,97,579,mate mateIn1 middlegame oneMove,https://lichess.org/nkJegacG#61,
00SPy,4r3/5pk1/pp3p2/7q/1P3P1p/P6P/4R1P1/3Q1R1K b - - 0 34,e8e2 f4f5 g7h6 d1d8,2422,94,86,74,advantage endgame quietMove short,https://lichess.org/b7nzWOyx/black#68,
00STy,8/1R5R/4kpp1/4p3/4P2K/5P1P/r7/6r1 b - - 10 40,a2h2 b7b6,1523,80,83,625,endgame master mate mateIn1 oneMove rookEndgame,https://lichess.org/yc8Ey5PU/black#80,
00SU7,2rqr1k1/B2b1ppp/5n2/8/3Q4/3B4/P1P2PPP/R3R1K1 w - - 3 22,d4h4 e8e1 a1e1 d8a5 e1a1 a5a7,1729,74,95,4769,advantage fork long middlegame,https://lichess.org/qmkkzrOG#43,
00SUF,1n6/1P6/5pp1/8/2k3PP/4P3/3K4/8 b - - 0 51,c4c5 h4h5 g6h5 g4h5 c5d6 h5h6,1344,78,64,864,crushing endgame knightEndgame long master,https://lichess.org/zGMp3vwR/black#102,
00Se9,5rk1/pp1n2r1/3p2N1/2pQ4/2P5/4P1P1/qP2KPP1/7R b - - 1 24,g7f7 g6e7 g8g7 d5g5,2069,76,95,2927,mate mateIn2 middlegame pin short,https://lichess.org/cMwUzce9/black#48,
00SeK,7k/pp5p/4r1pP/5pP1/3Q1n2/P1P5/KP6/5q2 b - - 1 35,h8g8 d4g7,995,179,89,29,endgame mate mateIn1 oneMove,https://lichess.org/GRpzFRNZ/black#70,
00SgB,b3rrk1/qn2R3/1p3ppp/1P1p4/1Q1PnB2/P3P3/4BPPP/5RK1 b - - 0 28,e8e7 b4e7 f8f7 e7e8 g8g7 f4h6,1246,75,95,1068,advantage exposedKing kingsideAttack long middlegame,https://lichess.org/twcqryGo/black#56,
00SiY,8/8/3p2N1/3Pp1n1/4Pp1p/3k1P1P/6K1/8 w - - 8 57,g6h4 d3e2 h4f5 g5f3,2086,77,91,2572,crushing endgame knightEndgame master short zugzwang,https://lichess.org/nqOd6mWK#113,
00SlL,r5k1/2p1qp1p/2b1p1pQ/pp5P/3P2P1/3P1r2/PP2N3/2KR3R b - - 0 23,f3d3 d1d3 c6h1 h5g6 f7g6 h6h1,2319,85,93,468,advantage discoveredAttack long middlegame,https://lichess.org/ktai3EiG/black#46,
00Sr6,4r2k/pQ5p/1p3p2/8/2p2P2/P6q/8/3R1RK1 w - - 0 37,b7f3 e8g8 g1f2 h3h2,1532,97,81,32,advantage endgame master short,https://lichess.org/jfGXGyER#73,
00SsI,6R1/p4p1p/2p1pp1k/8/2N5/4b1R1/4K1PP/2q5 b - - 1 29,e3g5 g3h3 g5h4 h3h4,1123,75,98,775,endgame,https://lichess.org/WfTPI1ZC/black#58,
00Svg,8/p7/1p4k1/2pN2p1/4Pp2/P1P4r/1P3KR1/8 w - - 6 50,f2e2 f4f3 e2f2 f3g2,1182,78,64,102,advancedPawn advantage endgame fork master short,https://lichess.org/hCcakyYf#99,
00Sz9,1r4k1/p4ppp/4p3/p5n1/4P3/1P1N1PPq/QB3b1P/R5K1 w - - 0 30,d3f2 g5f3 g1h1 h3h2,1011,77,90,814,kingsideAttack mate mateIn2 middlegame short,https://lichess.org/mJ2prRw1#59,
00T2k,2k5/p3qp2/bpp1p1p1/4P2r/P4n1p/5P2/BPQ2B1P/1K1R4 b - - 0 30,h5e5 c2c6 c8b8 d1d7 e7d7 c6d7,1466,74,94,833,advantage long middlegame queensideAttack,https://lichess.org/e3qC1Wvi/black#60,
00T4i,2r4k/q2b1Q1p/2p2P2/1p2p3/4P3/p2P3R/4N1rK/R7 w - - 0 38,h2g2 d7h3 g2h3 a7f7,1456,76,91,303,crushing discoveredAttack middlegame short,https://lichess.org/02qALj5P#75,
00T85,8/8/8/8/8/4K3/1k3Q2/1q6 b - - 5 53,b2c1 f2d2,1014,82,93,1509,endgame master mate mateIn1 oneMove queenEndgame,https://lichess.org/j3dOR5SJ/black#106,
00TAb,6k1/5pp1/p1N1b3/1n5p/1B4P1/P4P1P/2K5/8 b - - 2 42,e6d5 c6e7 g8h7 e7d5,694,97,94,282,advantage endgame fork master short,https://lichess.org/vPUJ0Lkg/black#84,
00TFd,1R6/8/p1P3k1/6pp/1P6/6PK/r6P/8 w - - 1 40,c6c7 g5g4 h3h4 a2h2,963,96,100,42,deflection endgame mate mateIn2 rookEndgame short,https://lichess.org/olkVoMlg#79,
00TLz,8/p3Q2p/6p1/4p1k1/5q2/8/Pr4PP/6K1 b - - 1 36,f4f6 h2h4 g5f5 g2g4 f5g4 e7f6,1464,75,82,539,advantage deflection endgame long,https://lichess.org/iQZPp2A2/black#72,
00TOX,b7/p1k1pp2/1pn2qp1/8/4B3/1PNR4/P1P2PP1/5K2 b - - 1 26,a7a6 c3d5 c7b8 d5f6,802,76,86,208,crushing endgame fork short,https://lichess.org/bAOdaE0p/black#52,
00TOt,5bk1/5ppp/8/Q7/3p4/8/P1K1q2P/2R5 w - - 2 33,a5d2 d4d3 c2c3 f8b4,1383,75,87,1477,crushing endgame short,https://lichess.org/azv2NWmg#65,
00TQf,4r1k1/p1R1n2p/4N3/5rK1/8/6PP/P3R3/8 w - - 3 46,g5g4 h7h5 g4h4 e7g6,1294,76,93,2006,endgame mate mateIn2 short,https://lichess.org/aPLWBAFg#91,
00TRo,5q1k/2r3p1/1p2p2b/3p2NQ/3P4/1p6/5R2/6K1 b - - 1 38,f8b4 h5e8 b4f8 f2f8,1758,76,93,3990,endgame mate mateIn2 short,https://lichess.org/h4dPcMj5/black#76,
00TU2,1k1r4/1p3Qp1/p2q3p/3N4/1b6/8/PP3PPP/2R3K1 w - - 4 22,d5b4 d6d1 c1d1 d8d1,600,92,92,1303,backRankMate endgame mate mateIn2 sacrifice short,https://lichess.org/p32396Rd#43,
00TV2,6k1/p1Q2p1p/4p1p1/3p4/1r6/7P/Pq3PP1/5RK1 b - - 2 26,b2a2 c7c8 g8g7 c8c3 d5d4 c3b4,1754,74,89,666,advantage endgame fork long master,https://lichess.org/6qHoYzpM/black#52,
00TXF,3R4/6pk/4rp1p/p1N1P3/1p3P2/1Pb4P/6P1/6K1 b - - 1 33,e6c6 e5e6 c6e6 c5e6,1720,75,90,182,crushing endgame short,https://lichess.org/l8slGC2i/black#66,
00Ta0,4k3/1R6/6p1/4Np1p/7P/2r3PK/5b2/8 w - - 11 47,e5g6 c3g3 h3h2 g3g6,1120,76,95,2274,crushing endgame fork short,https://lichess.org/kDwb7v3y#93,
00Tdk,r6r/4kppp/2pNpnq1/p1P1n3/8/B3P3/PP2QPPP/3R1RK1 w - - 7 20,e2d2 e5f3 g1h1 f3d2,962,91,94,1780,crushing middlegame pin short,https://lichess.org/UgDWX5rx#39,
00Tge,8/5k2/8/1p1p2pN/1PpP1nP1/2P1KP2/8/8 b - - 10 58,f4h5 g4h5 f7g7 f3f4,1122,78,95,2476,crushing endgame short,https://lichess.org/Jri9vZwO/black#116,
00TiV,8/1kp5/4n3/3pN3/r2P3R/2K4P/8/8 w - - 5 48,e5f3 a4a3 c3c2 a3f3,1157,82,93,1198,crushing endgame short skewer,https://lichess.org/Wm6c0Vk6#95,
00Tkj,2r2k1Q/p4pp1/1p2p1n1/4P1B1/q7/2r4R/P4PP1/4R1K1 b - - 3 28,g6h8 h3h8,912,99,87,38,master mate mateIn1 middlegame oneMove,https://lichess.org/tO9BeoLJ/black#56,
00Tll,5r1k/1pp3p1/7p/pP1N4/P3P3/2PP3P/3BnbPK/R7 w - - 2 27,d5c7 f2g3 h2h1 g3c7,1554,75,90,1478,advantage endgame fork short,https://lichess.org/rnssRcMM#53,
00Tmr,2r2rQk/6pp/p6N/1p1p4/2pq4/P6P/1P3PP1/4R1K1 b - - 9 36,f8g8 h6f7,997,79,100,245,endgame mate mateIn1 oneMove smotheredMate,https://lichess.org/d74dVX2e/black#72,
00TuA,8/6p1/8/pp2k1p1/2p2p2/2P1KPPP/PP6/8 w - - 0 37,e3f2 f4g3 f2g3 e5f5,2241,87,91,1334,crushing defensiveMove endgame pawnEndgame short,https://lichess.org/qtped91w#73,
00Ty5,3q1r1k/1b3ppp/p3p3/7N/1p1bp3/4B1Q1/PPr2PPP/R3R1K1 b - - 1 23,d4e3 g3g7,1161,82,41,105,kingsideAttack mate mateIn1 middlegame oneMove,https://lichess.org/UzadMAHf/black#46,
00Tya,r4rk1/6pp/1p1Bp3/p7/P1PP4/4nqP1/2QR3P/4R1K1 w - - 1 25,c2a2 f3f1 e1f1 f8f1,1373,75,100,493,kingsideAttack mate mateIn2 middlegame sacrifice short,https://lichess.org/uhMJDCas#49,
00U2C,8/8/6RP/2p5/p1k1pP2/4P3/np1K4/8 w - - 0 48,g6b6 a2b4 b6b4 c4b4 d2c2 b4a3 h6h7 a3a2,2367,90,90,1573,crushing defensiveMove endgame master quietMove veryLong,https://lichess.org/ZQ9GNX6h#95,
00UB0,1r2n3/p1p3bk/Pp1p2pp/1PqP1p2/5P2/1Q1P1N2/6BP/5R1K b - - 0 29,e8f6 d3d4 c5d5 f3g5,1532,98,62,66,crushing middlegame short,https://lichess.org/gMbTs2F4/black#58,
00UEs,8/3R3p/5kp1/8/2Bnp3/1P5P/P6r/4K3 b - - 1 40,f6e5 d7d5 e5f4 d5d4,1512,76,88,882,advantage deflection endgame master short,https://lichess.org/Owc0qiXL/black#80,
00UHZ,3n2k1/6p1/pp3p1p/8/2r1NR1P/6P1/1PP5/1K6 b - - 1 32,d8e6 e4f6 g7f6 f4c4,1071,79,89,3456,advantage discoveredAttack endgame short,https://lichess.org/bQ4MdAO1/black#64,
00UHs,r4rk1/ppp3pp/4p3/2P4P/1nNP2q1/P3QP2/1Pb2K2/R4B1R b - - 0 22,c2e4 c4e5 b4d5 e5g4 d5e3 f2e3,2194,75,91,478,crushing long middlegame,https://lichess.org/wLdDSwHk/black#44,
00UIZ,4k2r/rp1qb3/2p2nQ1/p2p2N1/3P2pP/P3P1P1/1P3P2/1K1R3R b - - 6 26,e8d8 g5f7 d8c7 f7h8,1043,153,38,28,advantage fork middlegame short,https://lichess.org/0ljJUBQ9/black#52,
00UJP,1r2q1k1/R1p4p/3pNp2/3P4/1p3pbb/1BP5/1P3PPK/Q4R2 w - - 2 28,a7c7 h4g3 h2g1 e8h5 c7g7 g8h8 f2g3 f4g3 f1f3 h5h2,2249,89,89,603,crushing middlegame sacrifice veryLong,https://lichess.org/qkY18hUD#55,
00UOA,6k1/5p1p/4pbp1/p2p4/2rP1P2/P3B1P1/1P2R1KP/8 b - - 0 30,f6d4 b2b3 c4c2 e2c2,1640,75,84,207,advantage endgame short,https://lichess.org/DUwr5LiX/black#60,
00UQj,6r1/pp1qbpk1/8/2pPp1r1/2P1Pp2/P1N2Qp1/3B2K1/R6R w - - 0 31,h1h3 d7h3 g2h3 g3g2,2268,86,89,1501,advancedPawn crushing master middlegame sacrifice short,https://lichess.org/uZNJ299M#61,
00UTH,3r3r/q4pk1/p4N2/1p2PQp1/P4n2/3p1P1P/1P4P1/3RR1K1 w - - 0 32,g1h2 h8h3 f5h3 f4h3,1842,74,82,128,crushing middlegame short,https://lichess.org/X5eq2VgN#63,
00UZP,5r1k/ppQ3p1/6qp/5r2/3Pp1b1/2P5/P2B1PPP/R4R1K w - - 5 22,c7b7 f5f2 f1f2 f8f2,1745,75,87,488,crushing middlegame short,https://lichess.org/4HQMl1VG#43,
00UgJ,1r1q1rk1/1b4b1/4p1pp/3pP3/p2B2P1/3B3Q/PPP5/2KR3R w - - 0 23,d3g6 d8g5 c1b1 g5g6,928,96,94,1861,advantage fork middlegame short,https://lichess.org/9kzSQDr4#45,
00Ui0,r5k1/5pp1/2p5/P1N4p/2Pp1n2/1P3P2/5P1P/3R2K1 w - - 1 26,d1d4 f4e2 g1f1 e2d4,659,96,92,1846,crushing endgame fork short,https://lichess.org/R2pJ0rIG#51,
00UkB,8/8/n1R4p/P5p1/r4p1k/7P/5PK1/8 b - - 5 50,a4a5 c6h6,561,94,96,167,endgame mate mateIn1 oneMove,https://lichess.org/A2DzkmFy/black#100,
00Upm,r5r1/1p5k/p2b1Pn1/2p1p1P1/P1PpP3/2P5/1P3KB1/R4R2 b - - 2 29,a8f8 f1h1 g6h4 h1h4,969,77,83,328,advantage middlegame short,https://lichess.org/6s5P4SQT/black#58,
00UqU,2k4r/q5p1/p2rpn1p/8/1RQP4/2P1P3/1P4PP/R5K1 b - - 0 25,a7c7 a1a6 c7c4 b4c4 c8d7 a6a7,2055,75,99,146,advantage exposedKing long middlegame queensideAttack,https://lichess.org/TjspGxP2/black#50,
00UwP,5rk1/p4pp1/3qb2p/1B1p4/1r1P4/Q3PN2/P4PPP/2R3K1 b - - 5 19,b4b1 a3d6 b1c1 b5f1,1315,76,100,377,advantage master middlegame short,https://lichess.org/Py4RR2HF/black#38,
00Uwn,3r1rk1/p1p2pbp/1p4p1/7n/4P3/1P2BP1q/P1B3QP/3R1R1K b - - 6 23,h3h4 e3g5 h5g3 g2g3,1627,75,93,2775,advantage fork middlegame short,https://lichess.org/Nqhta4GU/black#46,
00UyQ,4r1k1/p1p2pp1/1p5p/2Q1P3/5r1q/5R2/P3B1PP/R5K1 w - - 0 22,c5c7 f4f3 g2f3 h4d4 g1g2 d4a1,1604,76,97,729,advantage clearance fork long middlegame,https://lichess.org/kxyI8Okp#43,
00V0G,8/6P1/5k1K/8/8/3p4/PR6/6r1 w - - 1 49,b2d2 g1h1 d2h2 h1h2,1122,81,91,721,endgame mate mateIn2 rookEndgame short,https://lichess.org/UYjzL2st#97,
00V4d,b2r2k1/p2rqpp1/n2Npb1p/2Q1N3/1P6/P5P1/3RPPBP/3R2K1 w - - 3 23,c5b5 d7d6 e5g6 f7g6 d2d6 d8d6 d1d6 e7d6,2097,83,100,53,advantage middlegame veryLong,https://lichess.org/zfHTkXMN#45,
00V8g,8/4k3/8/1K1n4/P7/8/1P6/8 b - - 0 57,d5c7 b5c6 e7d8 c6b7 d8d7 a4a5,2390,83,78,89,crushing defensiveMove endgame knightEndgame long,https://lichess.org/iPi2LNEj/black#114,
00VC1,1k2r3/p2r1R2/2Q5/1p5p/P1P3p1/8/6PP/7K w - - 2 44,c6d7 e8e1 f7f1 e1f1,428,119,71,488,backRankMate endgame mate mateIn2 queenRookEndgame short,https://lichess.org/EjJXrCqs#87,
00VDN,3r4/3r2k1/p7/3p2p1/3R2Pp/1P2PK2/P2R4/8 w - - 0 38,e3e4 d5e4 f3e3 d7d4,1496,79,50,47,crushing discoveredAttack endgame master rookEndgame short,https://lichess.org/Tex5WhjM#75,
00VEX,4r1k1/3b1pp1/1B3q1p/r7/P1p1Q3/2P4P/5PP1/R4RK1 w - - 1 27,b6d4 e8e4 d4f6 g7f6,1315,76,80,267,crushing middlegame short,https://lichess.org/8qPPWVm7#53,
00VEe,3r4/4k3/3pn3/p3r1p1/PpB3K1/1P4P1/3R4/7R b - - 3 47,d8f8 h1h7 f8f7 h7f7 e7f7 d2d6,1782,76,90,282,crushing endgame long master masterVsMaster,https://lichess.org/igcJqKC1/black#94,
00VFK,8/6pk/7p/Q7/6P1/3q3K/1P5P/8 w - - 1 45,h3h4 g7g5 a5g5 h6g5,1009,93,93,982,crushing endgame master queenEndgame short,https://lichess.org/cuisbvqQ#89,
00VGt,3K4/8/2P5/6pp/1n6/5PkP/R5P1/8 w - - 3 61,a2a5 b4c6 d8d7 c6a5,824,98,92,427,crushing endgame fork short,https://lichess.org/kgtHwkuS#121,
00VIe,8/8/8/P6p/8/2RnkN2/r7/3K4 w - - 1 60,f3e1 a2d2,1905,80,94,19168,endgame mate mateIn1 oneMove vukovicMate,https://lichess.org/ugqyRWZm#119,
00VJF,2rr2k1/1pq2pp1/1B2pnp1/1Q1p4/8/2P2B2/PP4Pb/3RR2K b - - 1 32,c7d7 b5d7 f6d7 b6d8,1273,79,87,355,advantage middlegame short,https://lichess.org/x96V69hr/black#64,
00VNr,5rk1/npp3p1/p3pr1p/2b5/3NR3/4B2P/PPP2PP1/R5K1 w - - 5 22,e4e6 c5d4 e6f6 d4f6 e3a7 b7b6,1960,74,93,2573,crushing defensiveMove long middlegame,https://lichess.org/fNuigLTb#43,
00VRm,3r2k1/pQ3pp1/1p2p2p/8/2P5/1P6/P3qPPP/5RK1 w - - 0 22,b7a7 d8d1 a7a8 g8h7 a8e4 e2e4,1435,78,80,72,crushing endgame long master,https://lichess.org/9VSX0Fck#43,
00VhV,5k2/5P2/4K3/4p3/ppp1P3/2P1P3/PP4P1/8 w - - 2 50,g2g4 a4a3 c3b4 a3b2,1607,75,90,449,advancedPawn crushing endgame pawnEndgame short,https://lichess.org/ZIHizXwv#99,
00ViT,6k1/5pp1/4p2p/1p1bPP2/1P1P1KP1/1r6/3B1R1P/8 w - - 0 37,f5f6 g7g5,1402,111,69,82,endgame mate mateIn1 oneMove,https://lichess.org/GZhSC72T#73,
00VlM,1k6/1p2rp1p/1p4b1/1N1B4/2P2p2/3p3P/P2Rr3/2K2R2 w - - 4 34,f1f4 e2e1 c1b2 e7e2 b2c3 e1c1 c3d4 e2d2,2107,76,91,511,advantage clearance deflection exposedKing middlegame veryLong,https://lichess.org/bUns6omN#67,
00Vqp,8/5ppp/4p3/p6k/6R1/4P2P/3q1PP1/2R3K1 w - - 2 33,c1c7 d2d1 g1h2 d1d6 g2g3 d6c7,1552,75,86,215,crushing endgame fork long queenRookEndgame,https://lichess.org/XBjzqhJt#65,
00Vt0,1k4r1/pp3p2/3qp3/2N5/1P1bp3/P3P3/5P2/2RR1K2 b - - 1 27,d6e5 c5d7 b8a8 d7e5,777,99,93,715,advantage endgame fork short,https://lichess.org/Slko3RVs/black#54,
00W3Q,3r1k2/5p2/Np3P1p/1P2pR2/2p1N3/b1P1n3/P5PP/6K1 w - - 0 32,f5e5 d8d1 g1f2 e3g4 f2e2 d1d3,2157,92,83,62,advantage endgame fork long master masterVsMaster,https://lichess.org/aznxTSjS#63,
00W5B,1r4k1/p5pp/5p2/2Rb4/1P4P1/P2r4/3P3P/3B1RK1 b - - 3 34,d3d2 c5d5 d2d5 d1b3 g8f8 b3d5,1415,75,82,263,advantage attraction endgame long pin sacrifice,https://lichess.org/6Gi4gAvw/black#68,
00WAp,r5k1/4p2p/p5p1/1p1b2Q1/2p5/P4qN1/1P3P2/R2R2Kr w - - 2 28,g3h1 f3h1,1023,76,100,204,mate mateIn1 middlegame oneMove,https://lichess.org/dTOmcRL9#55,
00WG3,8/pk1r1Rp1/1p2p2p/4P1bP/3rN3/8/PP6/1K3R2 b - - 4 33,d4d1 f1d1 d7f7 e4d6 b7c7 d6f7,1049,76,89,221,crushing endgame fork long pin,https://lichess.org/Pwj0MKtJ/black#66,
00WJN,5Q2/7K/8/8/4p2P/3kq3/8/8 b - - 1 53,e3g3 f8a3 d3d2 a3g3,1324,78,85,615,crushing endgame queenEndgame short skewer,https://lichess.org/27eUCFoJ/black#106,
00WNb,8/8/1KpB4/Pb6/1P5p/5k2/8/8 b - - 3 55,f3g2 a5a6 g2f3 a6a7,1051,78,83,240,advancedPawn bishopEndgame crushing endgame master short,https://lichess.org/y1pq4fXt/black#110,
00WTN,8/7R/B2k4/2pnp3/P7/3KP3/1r6/8 w - - 1 43,a6c4 e5e4 d3e4 d5f6,2053,74,96,7259,attraction crushing endgame master short,https://lichess.org/BRK2G49n#85,
00WVK,k7/7R/p1P5/4K3/1P6/r6p/8/8 b - - 2 51,a3b3 h7h8 a8a7 c6c7,1972,76,91,355,advancedPawn crushing endgame master rookEndgame short,https://lichess.org/CMbwiChz/black#102,
00WbE,5rk1/2pp1q1p/n5p1/pp1PP3/3PB1PP/P2Q1p2/5P2/R5K1 w - - 0 25,d3b5 f7f4 b5d7 f4e4,1675,76,79,53,crushing endgame short,https://lichess.org/kCb1myun#49,
00Wfu,3qr1k1/p4p1p/6p1/3pQ3/8/1P3P2/P5PP/3R2K1 w - - 2 26,e5d5 e8e1 d1e1 d8d5,1324,106,73,30,advantage deflection endgame master short,https://lichess.org/gxWHwrUj#51,
00Wi9,8/8/3n1P2/2k5/2pp1K2/P7/8/3B4 w - - 2 63,f4e5 d4d3 f6f7 d6f7,1700,74,95,4743,crushing endgame master short,https://lichess.org/kGGKKGh6#125,
00WiB,3q1rk1/4pp1p/p4Pp1/4p1P1/b1PpP2Q/3n3P/Pr2N1B1/R4RK1 b - - 1 22,b2e2 h4h6 e7f6 g5f6 d8f6 f1f6,1360,74,93,1257,advantage long master middlegame,https://lichess.org/DU4WJjPm/black#44,
00WiX,1Q6/5kpp/1p2p3/p1p1r3/2Pn4/6P1/P4P1P/6K1 w - - 0 32,b8e5 d4f3 g1f1 f3e5,991,76,100,244,crushing endgame fork short,https://lichess.org/8Rt0e7k1#63,
00WiZ,3r1rk1/p3R2p/bp1P2p1/2P5/7Q/P2q1P1P/6P1/2R3K1 b - - 5 34,b6c5 h4h7,925,79,100,71,mate mateIn1 middlegame oneMove,https://lichess.org/tGch7j6L/black#68,
00WoW,8/4kppR/r1p1p2p/p3P2P/4P1P1/1pP1KP2/6B1/8 w - - 0 29,e3d2 a5a4 g2f1 a4a3 f1a6 a3a2,2087,80,91,1286,advancedPawn advantage endgame long master quietMove sacrifice,https://lichess.org/cuQl3aZ8#57,
00Wp4,3r1k2/p4p2/1p4p1/1Pn4p/4BP1P/6P1/P2p3K/3R4 b - - 1 44,c5d3 d1d2 d8d4 e4d3,1192,78,91,446,advantage endgame master short,https://lichess.org/qyB8QR8D/black#88,
00WqT,r4r2/1ppb1p2/p2p2pk/5P2/4P3/2PBB1R1/PKP2P1q/8 b - - 4 26,h6h5 d3e2 h5h4 e3g5,1719,76,97,19295,mate mateIn2 middlegame short,https://lichess.org/HcfiWViE/black#52,
00Wqc,4k3/5p2/3P4/p5p1/6Pp/1P1K3n/P7/2B5 w - - 0 33,d3e3 h3f4 e3f3 h4h3,1635,138,88,9,crushing endgame master quietMove short,https://lichess.org/dR2Wb2zs#65,
00WtH,8/2R2pk1/4p1pp/3p4/3Pq2P/1r2P1P1/5P1K/5Q2 w - - 2 45,f1c1 b3b1 c1b1 e4b1,1405,75,94,575,crushing endgame short,https://lichess.org/Xixh3rxR#89,
00Wyh,2r5/8/8/pNp1r2p/3kNppP/1P1P4/2R2K2/8 b - - 2 42,d4d3 c2d2 d3e4 b5d6,1704,76,94,12259,endgame mate mateIn2 sacrifice short,https://lichess.org/2mLJufzX/black#84,
00WzB,8/8/8/P1K1p3/5k1p/5b1B/5P2/8 w - - 3 46,h3f1 f3a8 c5d6 e5e4 f1g2 f4g4 a5a6 h4h3 g2h1 e4e3 h1a8 e3f2 a8f3 g4g3 a6a7 f2f1q a7a8q f1f3,2836,107,90,2224,advancedPawn bishopEndgame crushing endgame promotion quietMove veryLong,https://lichess.org/VEqrGfJg#91,
00X0Q,6R1/8/8/8/1KP5/3r4/PP3kp1/8 w - - 3 52,c4c5 d3g3 g8g3 f2g3 c5c6 g2g1q,1404,75,90,1511,advancedPawn crushing endgame long promotion rookEndgame,https://lichess.org/aWPHCaqm#103,
00X1l,5r1k/Q6p/1pb3p1/4q3/4p3/1BP2p1P/PP4P1/5RK1 b - - 0 30,f3g2 f1f8,848,100,83,371,endgame hangingPiece mate mateIn1 oneMove,https://lichess.org/IPGWdtue/black#60,
00X2S,2kr4/1p4pp/p1p1b3/Q3Bq2/8/4PB2/1PP2PPP/1K6 b - - 2 24,g7g5 a5c7,1134,244,30,18,endgame mate mateIn1 oneMove,https://lichess.org/4JI17kTq/black#48,
00X2j,8/5KP1/R1k5/8/2pp4/8/8/6r1 b - - 1 50,c6c5 a6g6 g1g6 f7g6 d4d3 g7g8q,1564,75,96,10158,advancedPawn crushing endgame long promotion rookEndgame,https://lichess.org/GY1HtJCo/black#100,
00X5a,3N3k/pQ5p/4p1p1/3q4/8/2b1P1P1/P3RPKP/4n3 w - - 1 28,g2h3 d5h5,1233,76,89,836,endgame master mate mateIn1 oneMove,https://lichess.org/lNuqw2ZK#55,
00X66,4r1k1/6pp/1R3p2/P7/1P1p4/2b3BP/5PP1/5K2 w - - 2 31,g3f4 e8e1,408,105,93,171,endgame mate mateIn1 oneMove,https://lichess.org/9WU44YEe#61,
00XAG,1r1r2k1/p3ppb1/b3q1pp/2p5/2N5/1Q1RB3/P4PPP/2R1N1K1 b - - 0 21,b8b3 d3d8 g8h7 a2b3,1901,200,29,29,advantage hangingPiece intermezzo master middlegame short,https://lichess.org/cfhyIaNG/black#42,
00XCT,6Q1/7K/2k5/3r4/8/8/8/8 w - - 5 82,h7h8 d5h5 g8h7 h5h7,1063,78,100,404,endgame equality queenRookEndgame short,https://lichess.org/I94rnuWS#163,
00XGg,2k4r/ppp2ppr/2n5/3b1N2/3p1bP1/5NP1/PPP1QP2/R3R1K1 w - - 1 20,g1g2 h7h2 g2f1 h2h1 f3g1 h1g1 f1g1 h8h1,1943,74,90,106,attraction mate mateIn4 middlegame pin sacrifice veryLong,https://lichess.org/HyzlukP8#39,
